"GeneSymbol","feature.name","Note","chrom","nDMSperGenekb","GeneName","Function","effect"
"NTRK1","gasAcul14474-RA","Similar to NTRK1: High affinity nerve growth factor receptor (Fragment) (Gallus gallus OX=9031)","Gy_chrXX",0.044849082836256,"High affinity nerve growth factor receptor","FUNCTION: Receptor tyrosine kinase involved in the development and the maturation of the central and peripheral nervous systems through regulation of proliferation, differentiation and survival of sympathetic and nervous neurons. High affinity receptor for NGF which is its primary ligand (PubMed:1281417, PubMed:15488758, PubMed:17196528, PubMed:1849459, PubMed:1850821, PubMed:22649032, PubMed:27445338, PubMed:8325889). Can also bind and be activated by NTF3/neurotrophin-3. However, NTF3 only supports axonal extension through NTRK1 but has no effect on neuron survival (By similarity). Upon dimeric NGF ligand-binding, undergoes homodimerization, autophosphorylation and activation (PubMed:1281417). Recruits, phosphorylates and/or activates several downstream effectors including SHC1, FRS2, SH2B1, SH2B2 and PLCG1 that regulate distinct overlapping signaling cascades driving cell survival and differentiation. Through SHC1 and FRS2 activates a GRB2-Ras-MAPK cascade that regulates cell differentiation and survival. Through PLCG1 controls NF-Kappa-B activation and the transcription of genes involved in cell survival. Through SHC1 and SH2B1 controls a Ras-PI3 kinase-AKT1 signaling cascade that is also regulating survival. In absence of ligand and activation, may promote cell death, making the survival of neurons dependent on trophic factors. {ECO:0000250|UniProtKB:P35739, ECO:0000250|UniProtKB:Q3UFB7, ECO:0000269|PubMed:11244088, ECO:0000269|PubMed:1281417, ECO:0000269|PubMed:15488758, ECO:0000269|PubMed:17196528, ECO:0000269|PubMed:1849459, ECO:0000269|PubMed:1850821, ECO:0000269|PubMed:22649032, ECO:0000269|PubMed:27445338, ECO:0000269|PubMed:27676246, ECO:0000269|PubMed:8155326, ECO:0000269|PubMed:8325889}.; FUNCTION: [Isoform TrkA-III]: Resistant to NGF, it constitutively activates AKT1 and NF-kappa-B and is unable to activate the Ras-MAPK signaling cascade. Antagonizes the anti-proliferative NGF-NTRK1 signaling that promotes neuronal precursors differentiation. Isoform TrkA-III promotes angiogenesis and has oncogenic activity when overexpressed. {ECO:0000269|PubMed:15488758}.","INTERGENERATIONAL"
"KIFAP3","gasAcul16119-RA","Similar to KIFAP3: Kinesin-associated protein 3 (Homo sapiens OX=9606)","Gy_chrVIII",0.0446070122223214,"Kinesin-associated protein 3","FUNCTION: Involved in tethering the chromosomes to the spindle pole and in chromosome movement. Binds to the tail domain of the KIF3A/KIF3B heterodimer to form a heterotrimeric KIF3 complex and may regulate the membrane binding of this complex.","INTERGENERATIONAL"
"DENND5A","gasAcul08270-RA","Similar to DENND5A: DENN domain-containing protein 5A (Homo sapiens OX=9606)","Gy_chrII",0.0443026758816233,"DENN domain-containing protein 5A","FUNCTION: Guanine nucleotide exchange factor (GEF) which may activate RAB6A and RAB39A and/or RAB39B. Promotes the exchange of GDP to GTP, converting inactive GDP-bound Rab proteins into their active GTP-bound form (By similarity). Involved in the negative regulation of neurite outgrowth (PubMed:27866705). {ECO:0000250|UniProtKB:Q6IQ26, ECO:0000269|PubMed:27866705}.","INTERGENERATIONAL"
"Cdh10","gasAcul22728-RA","Similar to Cdh10: Cadherin-10 (Mus musculus OX=10090)","Gy_chrXXI",0.043453700082562,"Cadherin-10","FUNCTION: Cadherins are calcium-dependent cell adhesion proteins. They preferentially interact with themselves in a homophilic manner in connecting cells; cadherins may thus contribute to the sorting of heterogeneous cell types.","INTERGENERATIONAL"
"Znf827","gasAcul09409-RA","Similar to Znf827: Zinc finger protein 827 (Mus musculus OX=10090)","Gy_chrIX",0.0434423736912985,"Zinc finger protein 827","FUNCTION: As part of a ribonucleoprotein complex composed at least of HNRNPK, HNRNPL and the circular RNA circZNF827 that nucleates the complex on chromatin, may negatively regulate the transcription of genes involved in neuronal differentiation (PubMed:33174841). Could also recruit the nucleosome remodeling and histone deacetylase/NuRD complex to telomeric regions of chromosomes to regulate chromatin remodeling as part of telomere maintenance (PubMed:25150861). {ECO:0000269|PubMed:25150861, ECO:0000269|PubMed:33174841}.","INTERGENERATIONAL"
"F8","gasAcul04497-RA","Similar to F8: Coagulation factor VIII (Sus scrofa OX=9823)","Gy_chrIV",0.0427441761060056,"Coagulation factor VIII","FUNCTION: Factor VIII, along with calcium and phospholipid, acts as a cofactor for factor IXa when it converts factor X to the activated form, factor Xa. {ECO:0000250}.","INFECTION_INDUCED"
"GRM7","gasAcul12648-RA","Similar to GRM7: Metabotropic glutamate receptor 7 (Homo sapiens OX=9606)","Gy_chrXII",0.0423074482262602,"Metabotropic glutamate receptor 7","FUNCTION: G-protein coupled receptor activated by glutamate that regulates axon outgrowth through the MAPK-cAMP-PKA signaling pathway during neuronal development (By similarity). Ligand binding causes a conformation change that triggers signaling via guanine nucleotide-binding proteins (G proteins) and modulates the activity of downstream effectors, such as adenylate cyclase that it inhibits. {ECO:0000250|UniProtKB:Q14831, ECO:0000269|PubMed:33500274, ECO:0000269|PubMed:8145723, ECO:0000269|PubMed:8288585}.","INFECTION_INDUCED"
"PPARGC1A","gasAcul05722-RA","Similar to PPARGC1A: Peroxisome proliferator-activated receptor gamma coactivator 1-alpha (Bos taurus OX=9913)","Gy_chrVII",0.0419287211740042,"Peroxisome proliferator-activated receptor gamma coactivator 1-alpha","FUNCTION: Transcriptional coactivator for steroid receptors and nuclear receptors (PubMed:12754525, PubMed:15744310, PubMed:23217713, PubMed:9529258). Greatly increases the transcriptional activity of PPARG and thyroid hormone receptor on the uncoupling protein promoter (PubMed:12754525, PubMed:15744310, PubMed:23217713, PubMed:9529258). Can regulate key mitochondrial genes that contribute to the program of adaptive thermogenesis (PubMed:12754525, PubMed:15744310, PubMed:23217713, PubMed:9529258). Plays an essential role in metabolic reprogramming in response to dietary availability through coordination of the expression of a wide array of genes involved in glucose and fatty acid metabolism (PubMed:12754525, PubMed:15744310, PubMed:23217713, PubMed:9529258). Acts as a key regulator of gluconeogenesis: stimulates hepatic gluconeogenesis by increasing the expression of gluconeogenic enzymes, and acting together with FOXO1 to promote the fasting gluconeogenic program (PubMed:12754525). Induces the expression of PERM1 in the skeletal muscle in an ESRRA-dependent manner (By similarity). Also involved in the integration of the circadian rhythms and energy metabolism (PubMed:17476214). Required for oscillatory expression of clock genes, such as BMAL1 and NR1D1, through the coactivation of RORA and RORC, and metabolic genes, such as PDK4 and PEPCK (PubMed:17476214). {ECO:0000250|UniProtKB:Q9UBK2, ECO:0000269|PubMed:12754525, ECO:0000269|PubMed:15744310, ECO:0000269|PubMed:17476214, ECO:0000269|PubMed:23217713, ECO:0000269|PubMed:9529258}.","INFECTION_INDUCED"
"MARK4","gasAcul07413-RA","Similar to MARK4: MAP/microtubule affinity-regulating kinase 4 (Homo sapiens OX=9606)","Gy_chrI",0.0417222963951936,"MAP/microtubule affinity-regulating kinase 4","FUNCTION: Serine/threonine-protein kinase (By similarity). Phosphorylates the microtubule-associated protein MAPT/TAU (By similarity). Also phosphorylates the microtubule-associated proteins MAP2 and MAP4 (By similarity). Involved in regulation of the microtubule network, causing reorganization of microtubules into bundles (By similarity). Required for the initiation of axoneme extension during cilium assembly (By similarity). Regulates the centrosomal location of ODF2 and phosphorylates ODF2 in vitro (By similarity). Plays a role in cell cycle progression, specifically in the G1/S checkpoint (By similarity). Reduces neuronal cell survival (By similarity). Plays a role in energy homeostasis by regulating satiety and metabolic rate (PubMed:22992738). Promotes adipogenesis by activating JNK1 and inhibiting the p38MAPK pathway, and triggers apoptosis by activating the JNK1 pathway (PubMed:24989893). Phosphorylates mTORC1 complex member RPTOR and acts as a negative regulator of the mTORC1 complex, probably due to disruption of the interaction between phosphorylated RPTOR and the RRAGA/RRAGC heterodimer which is required for mTORC1 activation (By similarity). Involved in NLRP3 positioning along microtubules by mediating NLRP3 recruitment to microtubule organizing center (MTOC) upon inflammasome activation (PubMed:28656979). {ECO:0000250|UniProtKB:Q96L34, ECO:0000269|PubMed:22992738, ECO:0000269|PubMed:24989893, ECO:0000269|PubMed:28656979}.","INFECTION_INDUCED"
"Znf521","gasAcul16749-RA","Similar to Znf521: Zinc finger protein 521 (Mus musculus OX=10090)","Gy_chrIII",0.041630240206486,"Zinc finger protein 521","FUNCTION: Transcription factor that can both act as an activator or a repressor depending on the context. Involved in BMP signaling and in the regulation of the immature compartment of the hematopoietic system. Associates with SMADs in response to BMP2 leading to activate transcription of BMP target genes. Acts as a transcriptional repressor via its interaction with EBF1, a transcription factor involved specification of B-cell lineage; this interaction preventing EBF1 to bind DNA and activate target genes.","INTERGENERATIONAL"
"Tp63","gasAcul16627-RA","Similar to Tp63: Tumor protein 63 (Mus musculus OX=10090)","Gy_chrVIII",0.0403486120077469,"Tumor protein 63","FUNCTION: Acts as a sequence specific DNA binding transcriptional activator or repressor. The isoforms contain a varying set of transactivation and auto-regulating transactivation inhibiting domains thus showing an isoform specific activity. May be required in conjunction with TP73/p73 for initiation of p53/TP53 dependent apoptosis in response to genotoxic insults and the presence of activated oncogenes. Involved in Notch signaling by probably inducing JAG1 and JAG2. Activates transcription of the p21 promoter (By similarity). Activates RIPK4 transcription. Plays a role in the regulation of epithelial morphogenesis. The ratio of DeltaN-type and TA*-type isoforms may govern the maintenance of epithelial stem cell compartments and regulate the initiation of epithelial stratification from the undifferentiated embryonal ectoderm. Required for limb formation from the apical ectodermal ridge. {ECO:0000250, ECO:0000269|PubMed:10227293, ECO:0000269|PubMed:10227294, ECO:0000269|PubMed:11932750, ECO:0000269|PubMed:14729569, ECO:0000269|PubMed:22197488}.","INFECTION_INDUCED"
"CEP112","gasAcul18190-RA","Similar to CEP112: Centrosomal protein of 112 kDa (Homo sapiens OX=9606)","Gy_chrXI",0.0402479272317476,"Centrosomal protein of 112 kDa",NA,"INFECTION_INDUCED"
"GGH","gasAcul10935-RA","Similar to GGH: Gamma-glutamyl hydrolase (Homo sapiens OX=9606)","Gy_chrXIII",0.0400128040973111,"Gamma-glutamyl hydrolase","FUNCTION: Hydrolyzes the polyglutamate sidechains of pteroylpolyglutamates. Progressively removes gamma-glutamyl residues from pteroylpoly-gamma-glutamate to yield pteroyl-alpha-glutamate (folic acid) and free glutamate. May play an important role in the bioavailability of dietary pteroylpolyglutamates and in the metabolism of pteroylpolyglutamates and antifolates. Exhibits either endo- or exopeptidase activity depending upon the tissue of origin. When secreted, it acts primarily as an endopeptidase (By similarity). {ECO:0000250}.","INFECTION_INDUCED"
"Atp11a","gasAcul07678-RA","Similar to Atp11a: Phospholipid-transporting ATPase IH (Mus musculus OX=10090)","Gy_chrI",0.0399361022364217,"Phospholipid-transporting ATPase IH","FUNCTION: Catalytic component of a P4-ATPase flippase complex which catalyzes the hydrolysis of ATP coupled to the transport of aminophospholipids, phosphatidylserines (PS) and phosphatidylethanolamines (PE), from the outer to the inner leaflet of the plasma membrane (PubMed:25315773, PubMed:25947375, PubMed:26567335, PubMed:29799007, PubMed:30018401, PubMed:36300302). Does not show flippase activity toward phosphatidylcholine (PC) (PubMed:34403372). Contributes to the maintenance of membrane lipid asymmetry with a specific role in morphogenesis of muscle cells. In myoblasts, mediates PS enrichment at the inner leaflet of plasma membrane, triggering PIEZO1-dependent Ca2+ influx and Rho GTPases signal transduction, subsequently leading to the assembly of cortical actomyosin fibers and myotube formation (PubMed:29799007). May be involved in the uptake of farnesyltransferase inhibitor drugs, such as lonafarnib. {ECO:0000269|PubMed:15860663, ECO:0000269|PubMed:25315773, ECO:0000269|PubMed:25947375, ECO:0000269|PubMed:26567335, ECO:0000269|PubMed:29799007, ECO:0000269|PubMed:30018401, ECO:0000269|PubMed:34403372, ECO:0000269|PubMed:36300302, ECO:0000305}.","INTERGENERATIONAL"
"SPATA20","gasAcul20924-RA","Similar to SPATA20: Spermatogenesis-associated protein 20 (Homo sapiens OX=9606)","Gy_chrV",0.0391297542651432,"Spermatogenesis-associated protein 20","FUNCTION: May play a role in fertility regulation.","INTERACTION"
"Cit","gasAcul11460-RA","Similar to Cit: Citron Rho-interacting kinase (Mus musculus OX=10090)","Gy_chrXIII",0.0390350534780233,"Citron Rho-interacting kinase","FUNCTION: Plays a role in cytokinesis (By similarity). Required for KIF14 localization to the central spindle and midbody (By similarity). Putative RHO/RAC effector that binds to the GTP-bound forms of RHO and RAC1 (By similarity). It probably binds p21 with a tighter specificity in vivo (By similarity). Displays serine/threonine protein kinase activity (By similarity). Plays an important role in the regulation of cytokinesis and the development of the central nervous system (PubMed:24695496). Phosphorylates MYL9/MLC2 (By similarity). {ECO:0000250|UniProtKB:O14578, ECO:0000269|PubMed:24695496}.","INTERGENERATIONAL"
"OXR1","gasAcul15105-RA","Similar to OXR1: Oxidation resistance protein 1 (Homo sapiens OX=9606)","Gy_chrXX",0.0383171124224079,"Oxidation resistance protein 1","FUNCTION: May be involved in protection from oxidative damage. {ECO:0000250}.","INTERGENERATIONAL"
"rnf213a","gasAcul18134-RA","Similar to rnf213a: E3 ubiquitin-protein ligase rnf213-alpha (Danio rerio OX=7955)","Gy_chrXI",0.0378286362776622,"E3 ubiquitin-protein ligase rnf213-alpha","FUNCTION: Atypical E3 ubiquitin ligase that can catalyze ubiquitination of both proteins and lipids, and which is involved in various processes, such as lipid metabolism, angiogenesis and cell-autonomous immunity (By similarity). Acts as a key immune sensor by catalyzing ubiquitination of the lipid A moiety of bacterial lipopolysaccharide (LPS) via its RZ-type zinc-finger: restricts the proliferation of cytosolic bacteria, such as Salmonella, by generating the bacterial ubiquitin coat through the ubiquitination of LPS (By similarity). Ubiquitination of LPS triggers cell-autonomous immunity, such as antibacterial autophagy, leading to degradation of the microbial invader (By similarity). Involved in lipid metabolism by regulating fat storage and lipid droplet formation; act by inhibiting the lipolytic process (PubMed:30705059). Also regulates lipotoxicity by inhibiting desaturation of fatty acids (By similarity). Also acts as an E3 ubiquitin-protein ligase via its RING-type zinc finger (By similarity). Involved in the non-canonical Wnt signaling pathway in vascular development: acts by mediating ubiquitination and degradation of proteins downstream of rspo3, leading to inhibit the non-canonical Wnt signaling pathway and promoting vessel regression (By similarity). Also has ATPase activity; ATPase activity is required for ubiquitination of LPS (By similarity). Also involved in neuromuscular regulation (PubMed:26530008). {ECO:0000250|UniProtKB:Q63HN8, ECO:0000269|PubMed:26530008, ECO:0000269|PubMed:30705059}.","INFECTION_INDUCED"
"Dpp6","gasAcul16759-RA","Similar to Dpp6: Dipeptidyl aminopeptidase-like protein 6 (Rattus norvegicus OX=10116)","Gy_chrIII",0.0373887684139684,"Dipeptidyl aminopeptidase-like protein 6","FUNCTION: Promotes cell surface expression of the potassium channel KCND2 (PubMed:15454437, PubMed:19441798). Modulates the activity and gating characteristics of the potassium channel KCND2 (PubMed:18364354). Has no dipeptidyl aminopeptidase activity (PubMed:15476821, PubMed:8103397). {ECO:0000269|PubMed:15454437, ECO:0000269|PubMed:18364354, ECO:0000269|PubMed:8103397, ECO:0000305|PubMed:15476821}.","INFECTION_INDUCED"
"ptprf","gasAcul17319-RA","Similar to ptprf: Receptor-type tyrosine-protein phosphatase F (Danio rerio OX=7955)","Gy_chrIII",0.0369558254699549,"Receptor-type tyrosine-protein phosphatase F","FUNCTION: Possible cell adhesion receptor. It possesses an intrinsic protein tyrosine phosphatase activity (PTPase) and dephosphorylates EPHA2 regulating its activity (By similarity). {ECO:0000250}.","INFECTION_INDUCED"
"ERBIN","gasAcul20189-RA","Similar to ERBIN: Erbin (Homo sapiens OX=9606)","Gy_chrXIV",0.0368269868159387,"Erbin","FUNCTION: Acts as an adapter for the receptor ERBB2, in epithelia. By binding the unphosphorylated ERBB2 'Tyr-1248' receptor, it may contribute to stabilize this unphosphorylated state (By similarity). Inhibits NOD2-dependent NF-kappa-B signaling and pro-inflammatory cytokine secretion (PubMed:16203728). {ECO:0000250|UniProtKB:Q96RT1, ECO:0000269|PubMed:16203728}.","INTERGENERATIONAL"
"MNAT1","gasAcul18925-RA","Similar to MNAT1: CDK-activating kinase assembly factor MAT1 (Homo sapiens OX=9606)","Gy_chrXV",0.0365751069821879,"CDK-activating kinase assembly factor MAT1","FUNCTION: Stabilizes the cyclin H-CDK7 complex to form a functional CDK-activating kinase (CAK) enzymatic complex. CAK activates the cyclin-associated kinases CDK1, CDK2, CDK4 and CDK6 by threonine phosphorylation. CAK complexed to the core-TFIIH basal transcription factor activates RNA polymerase II by serine phosphorylation of the repetitive C-terminal domain (CTD) of its large subunit (POLR2A), allowing its escape from the promoter and elongation of the transcripts. Involved in cell cycle control and in RNA transcription by RNA polymerase II. {ECO:0000269|PubMed:10024882}.","INFECTION_INDUCED"
"FMN1","gasAcul18746-RA","Similar to FMN1: Formin-1 (Homo sapiens OX=9606)","Gy_chrXV",0.036411302068162,"Formin-1","FUNCTION: Reducing polyketide synthase; part of the gene cluster that mediates the biosynthesis of fusamarins, isocoumarin derivatives that show moderate cytotoxicity with IC(50) values between 1 and 50 uM (PubMed:36137261). The polyketide synthase FMN1 probably synthesizes two different polyketides, a tetra- and a pentaketide, containinga varying number of double bonds depending on the selective actions of the trans-enoyl reductase FMN2 (PubMed:36137261). Chain fusion will presumably be mediated by the KS domain before finally offloading is catalyzed by the alpha/beta hydrolase fold enzyme FMN3 (PubMed:36137261). {ECO:0000269|PubMed:36137261}.","INFECTION_INDUCED"
"rbfox2","gasAcul08753-RA","Similar to rbfox2: RNA binding protein fox-1 homolog 2 (Xenopus laevis OX=8355)","Gy_chrIX",0.0363015936399608,"RNA binding protein fox-1 homolog 2","FUNCTION: RNA-binding protein that regulates alternative splicing events by binding to 5'-UGCAUGU-3' elements. Prevents binding of U2AF2 to the 3'-splice site. Regulates alternative splicing of tissue-specific exons and of differentially spliced exons during erythropoiesis. Seems to act as a coregulatory factor of ER-alpha (By similarity). Together with RNA binding proteins RBPMS and MBNL1/2, activates vascular smooth muscle cells alternative splicing events (PubMed:37548402). {ECO:0000250, ECO:0000269|PubMed:37548402}.","INFECTION_INDUCED"
"GAB2","gasAcul07378-RA","Similar to GAB2: GRB2-associated-binding protein 2 (Homo sapiens OX=9606)","Gy_chrI",0.036106296938186,"GRB2-associated-binding protein 2","FUNCTION: Adapter protein which acts downstream of several membrane receptors including cytokine, antigen, hormone, cell matrix and growth factor receptors to regulate multiple signaling pathways. Regulates osteoclast differentiation mediating the TNFRSF11A/RANK signaling. In allergic response, it plays a role in mast cells activation and degranulation through PI-3-kinase regulation. Also involved in the regulation of cell proliferation and hematopoiesis (By similarity). {ECO:0000250}.","INFECTION_INDUCED"
"plekha7","gasAcul08253-RA","Similar to plekha7: Pleckstrin homology domain-containing family A member 7 (Danio rerio OX=7955)","Gy_chrII",0.0356544371947089,"Pleckstrin homology domain-containing family A member 7","FUNCTION: Required for zonula adherens biogenesis and maintenance. {ECO:0000250}.","INFECTION_INDUCED"
"ENDOD1","gasAcul04544-RA","Similar to ENDOD1: Endonuclease domain-containing 1 protein (Homo sapiens OX=9606)","Gy_chrIV",0.0352050695300123,"Endonuclease domain-containing 1 protein","FUNCTION: May act as a DNase and a RNase. Plays a role in the modulation of innate immune signaling through the cGAS-STING pathway by interacting with RNF26. {ECO:0000269|PubMed:32614325}.","INFECTION_INDUCED"
"SYNRG","gasAcul07295-RA","Similar to SYNRG: Synergin gamma (Homo sapiens OX=9606)","Gy_chrI",0.0351345653854262,"Synergin gamma","FUNCTION: Plays a role in endocytosis and/or membrane trafficking at the trans-Golgi network (TGN) (By similarity). May act by linking the adapter protein complex AP-1 to other proteins (By similarity). Component of clathrin-coated vesicles (By similarity). Component of the aftiphilin/p200/gamma-synergin complex, which plays roles in AP1G1/AP-1-mediated protein trafficking including the trafficking of transferrin from early to recycling endosomes, and the membrane trafficking of furin and the lysosomal enzyme cathepsin D between the trans-Golgi network (TGN) and endosomes (By similarity). {ECO:0000250|UniProtKB:Q9UMZ2}.","INFECTION_INDUCED"
"PAX7","gasAcul13485-RA","Similar to PAX7: Paired box protein Pax-7 (Homo sapiens OX=9606)","Gy_chrXII",0.0348991414811196,"Paired box protein Pax-7","FUNCTION: Transcription factor that is involved in the regulation of muscle stem cells proliferation, playing a role in myogenesis and muscle regeneration. {ECO:0000269|PubMed:31092906}.","INFECTION_INDUCED"
"Sema4c","gasAcul11418-RA","Similar to Sema4c: Semaphorin-4C (Mus musculus OX=10090)","Gy_chrXIII",0.0347523892267593,"Semaphorin-4C","FUNCTION: Cell surface receptor for PLXNB2 that plays an important role in cell-cell signaling. PLXNB2 binding promotes downstream activation of RHOA and phosphorylation of ERBB2 at 'Tyr-1248'. Required for normal brain development, axon guidance and cell migration. Probable signaling receptor which may play a role in myogenic differentiation through activation of the stress-activated MAPK cascade. {ECO:0000269|PubMed:15811348, ECO:0000269|PubMed:17498836, ECO:0000269|PubMed:17554007, ECO:0000269|PubMed:21122816}.","INFECTION_INDUCED"
"Ago1","gasAcul14545-RA","Similar to Ago1: Protein argonaute-1 (Mus musculus OX=10090)","Gy_chrXX",0.034331227684702,"Protein argonaute-1","FUNCTION: Involved in RNA-mediated gene silencing (RNAi) of mobile elements and repeats including retroposons SLACS (Spliced Leader Associated Conserved Sequence), TATE (Telomere-Associated Transposable Element) and TAS-like sequences (Telomere Associated Sequence), and a family of 74-nucleotide long tandem repeats, CIR74 (PubMed:21060810, PubMed:23217017). Predominantly binds to siRNAs derived from SLACS and TATE transposable elements and to a lesser extent to siRNAs from TAS-like and CIR74 elements (PubMed:23217017). {ECO:0000269|PubMed:21060810, ECO:0000269|PubMed:23217017}.","INFECTION_INDUCED"
"UNC80","gasAcul07691-RA","Similar to UNC80: Protein unc-80 homolog (Homo sapiens OX=9606)","Gy_chrI",0.0340703894245511,"Protein unc-80 homolog","FUNCTION: Auxiliary subunit of the NALCN sodium channel complex (PubMed:19092807, PubMed:21040849, PubMed:32620897). The NALCN sodium channel complex is a voltage-gated ion channel responsible for the resting Na(+) permeability that controls neuronal excitability (PubMed:32620897). This complex is activated by neuropeptides substance P, neurotensin. In addition, the channel is inhibited by extracellular Ca(2+) through the Ca(2+)-sensing receptor. UNC80 is essential for NALCN sensitivity to extracellular calcium. {ECO:0000269|PubMed:19092807, ECO:0000269|PubMed:21040849, ECO:0000269|PubMed:32620897}.","INFECTION_INDUCED"
"TANC2","gasAcul21099-RA","Similar to TANC2: Protein TANC2 (Homo sapiens OX=9606)","Gy_chrV",0.0340506673930809,"Protein TANC2","FUNCTION: Scaffolding protein in the dendritic spines which acts as immobile postsynaptic posts able to recruit KIF1A-driven dense core vesicles to dendritic spines. {ECO:0000250|UniProtKB:F1LTE0}.","INFECTION_INDUCED"
