"GeneSymbol","feature.name","Note","chrom","nDMSperGenekb","GeneName","Function","effect"
"OPRM1","gasAcul19918-RA","Similar to OPRM1: Mu-type opioid receptor (Macaca fascicularis OX=9541)","Gy_chrX",0.194931773879142,"Mu-type opioid receptor","FUNCTION: Receptor for endogenous opioids such as beta-endorphin and endomorphin (PubMed:11060299, PubMed:15944153, PubMed:16682964, PubMed:17384143, PubMed:17947509, PubMed:1846076, PubMed:18558479, PubMed:21292762, PubMed:7595566, PubMed:7678862, PubMed:8051154, PubMed:8240812, PubMed:8393525, PubMed:9224819, PubMed:9572309). Receptor for natural and synthetic opioids including morphine, heroin, DAMGO, fentanyl, etorphine, buprenorphin and methadone (PubMed:11060299, PubMed:15944153, PubMed:16682964, PubMed:17384143, PubMed:17947509, PubMed:1846076, PubMed:18558479, PubMed:21292762, PubMed:7595566, PubMed:7678862, PubMed:8051154, PubMed:8240812, PubMed:8393525, PubMed:9224819, PubMed:9572309). Also activated by enkephalin peptides, such as Met-enkephalin or Met-enkephalin-Arg-Phe, with higher affinity for Met-enkephalin-Arg-Phe (PubMed:8624732). Agonist binding to the receptor induces coupling to an inactive GDP-bound heterotrimeric G-protein complex and subsequent exchange of GDP for GTP in the G-protein alpha subunit leading to dissociation of the G-protein complex with the free GTP-bound G-protein alpha and the G-protein beta-gamma dimer activating downstream cellular effectors (PubMed:16682964, PubMed:9224819). The agonist- and cell type-specific activity is predominantly coupled to pertussis toxin-sensitive G(i) and G(o) G alpha proteins, GNAI1, GNAI2, GNAI3 and GNAO1 isoforms Alpha-1 and Alpha-2, and to a lesser extent to pertussis toxin-insensitive G alpha proteins GNAZ and GNA15 (PubMed:9224819, PubMed:9572309). They mediate an array of downstream cellular responses, including inhibition of adenylate cyclase activity and both N-type and L-type calcium channels, activation of inward rectifying potassium channels, mitogen-activated protein kinase (MAPK), phospholipase C (PLC), phosphoinositide/protein kinase (PKC), phosphoinositide 3-kinase (PI3K) and regulation of NF-kappa-B (PubMed:15944153, PubMed:21292762, PubMed:7595566, PubMed:9572309). Also couples to adenylate cyclase stimulatory G alpha proteins (PubMed:7595566). The selective temporal coupling to G-proteins and subsequent signaling can be regulated by RGSZ proteins, such as RGS9, RGS17 and RGS4. Phosphorylation by members of the GPRK subfamily of Ser/Thr protein kinases and association with beta-arrestins is involved in short-term receptor desensitization (PubMed:11060299, PubMed:17384143, PubMed:17947509, PubMed:18558479). Beta-arrestins associate with the GPRK-phosphorylated receptor and uncouple it from the G-protein thus terminating signal transduction. The phosphorylated receptor is internalized through endocytosis via clathrin-coated pits which involves beta-arrestins. The activation of the ERK pathway occurs either in a G-protein-dependent or a beta-arrestin-dependent manner and is regulated by agonist-specific receptor phosphorylation (PubMed:11278523, PubMed:11896051, PubMed:15944153). Acts as a class A G-protein coupled receptor (GPCR) which dissociates from beta-arrestin at or near the plasma membrane and undergoes rapid recycling. Receptor down-regulation pathways are varying with the agonist and occur dependent or independent of G-protein coupling (PubMed:11060299, PubMed:17384143, PubMed:17947509, PubMed:18558479). Endogenous ligands induce rapid desensitization, endocytosis and recycling. Heterooligomerization with other GPCRs can modulate agonist binding, signaling and trafficking properties (PubMed:16682964, PubMed:17384143). {ECO:0000269|PubMed:11060299, ECO:0000269|PubMed:11278523, ECO:0000269|PubMed:11896051, ECO:0000269|PubMed:15944153, ECO:0000269|PubMed:16682964, ECO:0000269|PubMed:17384143, ECO:0000269|PubMed:17947509, ECO:0000269|PubMed:1846076, ECO:0000269|PubMed:18558479, ECO:0000269|PubMed:21292762, ECO:0000269|PubMed:7595566, ECO:0000269|PubMed:7678862, ECO:0000269|PubMed:8051154, ECO:0000269|PubMed:8240812, ECO:0000269|PubMed:8393525, ECO:0000269|PubMed:8624732, ECO:0000269|PubMed:9224819, ECO:0000269|PubMed:9572309}.","INFECTION_INDUCED"
"ndfip1l","gasAcul06526-RA","Similar to ndfip1l: NEDD4 family-interacting protein 1-like (Danio rerio OX=7955)","Gy_chrVII",0.193535900909619,"NEDD4 family-interacting protein 1-like","FUNCTION: May play a role in Golgi structure maintenance. {ECO:0000250}.","INFECTION_INDUCED"
"CYP1B1","gasAcul18755-RA","Similar to CYP1B1: Cytochrome P450 1B1 (Homo sapiens OX=9606)","Gy_chrXV",0.193386192225875,"Cytochrome P450 1B1","FUNCTION: A cytochrome P450 monooxygenase involved in the metabolism of various endogenous substrates, including fatty acids, steroid hormones and vitamins (PubMed:10681376, PubMed:11555828, PubMed:12865317, PubMed:15258110, PubMed:20972997). Mechanistically, uses molecular oxygen inserting one oxygen atom into a substrate, and reducing the second into a water molecule, with two electrons provided by NADPH via cytochrome P450 reductase (NADPH--hemoprotein reductase) (PubMed:10681376, PubMed:11555828, PubMed:12865317, PubMed:15258110, PubMed:20972997). Exhibits catalytic activity for the formation of hydroxyestrogens from estrone (E1) and 17beta-estradiol (E2), namely 2- and 4-hydroxy E1 and E2. Displays a predominant hydroxylase activity toward E2 at the C-4 position (PubMed:11555828, PubMed:12865317). Metabolizes testosterone and progesterone to B or D ring hydroxylated metabolites (PubMed:10426814). May act as a major enzyme for all-trans retinoic acid biosynthesis in extrahepatic tissues. Catalyzes two successive oxidative transformation of all-trans retinol to all-trans retinal and then to the active form all-trans retinoic acid (PubMed:10681376, PubMed:15258110). Catalyzes the epoxidation of double bonds of certain PUFA. Converts arachidonic acid toward epoxyeicosatrienoic acid (EpETrE) regioisomers, 8,9-, 11,12-, and 14,15- EpETrE, that function as lipid mediators in the vascular system (PubMed:20972997). Additionally, displays dehydratase activity toward oxygenated eicosanoids hydroperoxyeicosatetraenoates (HpETEs). This activity is independent of cytochrome P450 reductase, NADPH, and O2 (PubMed:21068195). Also involved in the oxidative metabolism of xenobiotics, particularly converting polycyclic aromatic hydrocarbons and heterocyclic aryl amines procarcinogens to DNA-damaging products (PubMed:10426814). Plays an important role in retinal vascular development. Under hyperoxic O2 conditions, promotes retinal angiogenesis and capillary morphogenesis, likely by metabolizing the oxygenated products generated during the oxidative stress. Also, contributes to oxidative homeostasis and ultrastructural organization and function of trabecular meshwork tissue through modulation of POSTN expression (By similarity). {ECO:0000250|UniProtKB:Q64429, ECO:0000269|PubMed:10426814, ECO:0000269|PubMed:10681376, ECO:0000269|PubMed:11555828, ECO:0000269|PubMed:12865317, ECO:0000269|PubMed:15258110, ECO:0000269|PubMed:20972997, ECO:0000269|PubMed:21068195}.","INTERGENERATIONAL"
"KLC2","gasAcul05545-RA","Similar to KLC2: Kinesin light chain 2 (Homo sapiens OX=9606)","Gy_chrVII",0.192196809532962,"Kinesin light chain 2","FUNCTION: Kinesin is a microtubule-associated force-producing protein that plays a role in organelle transport. The light chain functions in coupling of cargo to the heavy chain or in the modulation of its ATPase activity. Through binding with PLEKHM2 and ARL8B, recruits kinesin-1 to lysosomes and hence direct lysosomes movement toward microtubule plus ends. {ECO:0000250|UniProtKB:Q9H0B6}.","INFECTION_INDUCED"
"unknown","gasAcul20890-RA","Protein of unknown function","Gy_chrV",0.192049164586134,NA,NA,"INTERGENERATIONAL"
"FKBP1B","gasAcul22125-RA","Similar to FKBP1B: Peptidyl-prolyl cis-trans isomerase FKBP1B (Homo sapiens OX=9606)","Gy_chrXVIII",0.191607587660471,"Peptidyl-prolyl cis-trans isomerase FKBP1B","FUNCTION: Has the potential to contribute to the immunosuppressive and toxic effects of FK506 and rapamycin. PPIases accelerate the folding of proteins. It catalyzes the cis-trans isomerization of proline imidic peptide bonds in oligopeptides. {ECO:0000269|PubMed:7513996, ECO:0000269|PubMed:7592869}.","INFECTION_INDUCED"
"creb3l3b","gasAcul16513-RA","Similar to creb3l3b: Cyclic AMP-responsive element-binding protein 3-like protein 3-B (Danio rerio OX=7955)","Gy_chrVIII",0.191387559808612,"Cyclic AMP-responsive element-binding protein 3-like protein 3-B","FUNCTION: Transcriptional activator. Binds the cAMP response element (CRE). Activates transcription through box-B element and CRE. Seems to function synergistically with atf6 (By similarity). Regulates FGF21 transcription (By similarity). {ECO:0000250, ECO:0000250|UniProtKB:Q91XE9}.","INTERGENERATIONAL"
"uba3","gasAcul12420-RA","Similar to uba3: NEDD8-activating enzyme E1 catalytic subunit (Danio rerio OX=7955)","Gy_chrXVII",0.18875047187618,"NEDD8-activating enzyme E1 catalytic subunit","FUNCTION: Activates ubiquitin by first adenylating its C-terminal glycine residue with ATP, and thereafter linking this residue to the side chain of a cysteine residue in E1, yielding a ubiquitin-E1 thioester and free AMP. {ECO:0000269|PubMed:1634524}.","INTERGENERATIONAL"
"vegfaa","gasAcul22218-RA","Similar to vegfaa: Vascular endothelial growth factor A-A (Danio rerio OX=7955)","Gy_chrXVIII",0.187055742611298,"Vascular endothelial growth factor A-A","FUNCTION: Growth factor active in angiogenesis, vasculogenesis and endothelial cell growth. Induces endothelial cell proliferation, promotes cell migration, inhibits apoptosis, and induces permeabilization of blood vessels. Required for intersegmental vessel development in the tail during embryogenesis (PubMed:15305301). Acts both upstream of kdr and tie1 to stimulate endothelial cell differentiation, and upstream of gata1 to stimulate hematopoietic cell differentiation. {ECO:0000250|UniProtKB:P15692, ECO:0000269|PubMed:11578859, ECO:0000269|PubMed:15305301, ECO:0000269|PubMed:17698971}.","INFECTION_INDUCED"
"gja1","gasAcul21575-RA","Similar to gja1: Gap junction alpha-1 protein (Danio rerio OX=7955)","Gy_chrXVIII",0.184672206832872,"Gap junction alpha-1 protein","FUNCTION: Gap junction protein that acts as a regulator of bladder capacity. A gap junction consists of a cluster of closely packed pairs of transmembrane channels, the connexons, through which materials of low MW diffuse from one cell to a neighboring cell. May play a critical role in the physiology of hearing by participating in the recycling of potassium to the cochlear endolymph. Negative regulator of bladder functional capacity: acts by enhancing intercellular electrical and chemical transmission, thus sensitizing bladder muscles to cholinergic neural stimuli and causing them to contract. May play a role in cell growth inhibition through the regulation of NOV expression and localization. Plays an essential role in gap junction communication in the ventricles (By similarity). {ECO:0000250|UniProtKB:P08050, ECO:0000250|UniProtKB:P23242}.","INFECTION_INDUCED"
"Cdr2","gasAcul21143-RA","Similar to Cdr2: Cerebellar degeneration-related protein 2 (Mus musculus OX=10090)","Gy_chrV",0.179340028694405,"Cerebellar degeneration-related protein 2","FUNCTION: Pleiotropic ABC efflux transporter that confers resistance to structurally and functionally unrelated compounds including caspofungin or azoles such as fluconazole, itraconazole, posaconazole, voriconazole, and isavuconazole (PubMed:11257032, PubMed:12244114, PubMed:12557277, PubMed:15105134, PubMed:15388433, PubMed:16803598, PubMed:17581937, PubMed:20038613, PubMed:24273749, PubMed:24838041, PubMed:26482310, PubMed:27486188, PubMed:29371812). Does not play a role in the azole resistance in mature biofilms (PubMed:18651314). {ECO:0000269|PubMed:11257032, ECO:0000269|PubMed:12244114, ECO:0000269|PubMed:12557277, ECO:0000269|PubMed:15105134, ECO:0000269|PubMed:15388433, ECO:0000269|PubMed:16803598, ECO:0000269|PubMed:17581937, ECO:0000269|PubMed:18651314, ECO:0000269|PubMed:20038613, ECO:0000269|PubMed:24273749, ECO:0000269|PubMed:24838041, ECO:0000269|PubMed:26482310, ECO:0000269|PubMed:27486188, ECO:0000269|PubMed:29371812}.","INTERGENERATIONAL"
"unknown","gasAcul08532-RA","Protein of unknown function","Gy_chrII",0.17905102954342,NA,NA,"INTERGENERATIONAL"
"Prpsap2","gasAcul17742-RA","Similar to Prpsap2: Phosphoribosyl pyrophosphate synthase-associated protein 2 (Rattus norvegicus OX=10116)","Gy_chrXI",0.178157847853198,"Phosphoribosyl pyrophosphate synthase-associated protein 2","FUNCTION: Seems to play a negative regulatory role in 5-phosphoribose 1-diphosphate synthesis. {ECO:0000250}.","INFECTION_INDUCED"
"SERINC3","gasAcul12562-RA","Similar to SERINC3: Serine incorporator 3 (Pongo abelii OX=9601)","Gy_chrXVII",0.177367860943597,"Serine incorporator 3","FUNCTION: Restriction factor required to restrict infectivity of gammaretroviruses: acts by inhibiting early step of viral infection and impairing the ability of the viral particle to translocate its content to the cytoplasm. {ECO:0000250|UniProtKB:Q13530}.","INTERGENERATIONAL"
"WDR6","gasAcul13316-RA","Similar to WDR6: WD repeat-containing protein 6 (Pongo abelii OX=9601)","Gy_chrXII",0.176772140710624,"WD repeat-containing protein 6","FUNCTION: Together with methyltransferase FTSJ1, methylates the 2'-O-ribose of nucleotides at position 34 of the tRNA anticodon loop of substrate tRNAs (By similarity). Required for the correct positioning of the substrate tRNA for methylation (By similarity). Required to suppress amino acid starvation-induced autophagy (By similarity). Enhances the STK11/LKB1-induced cell growth suppression activity (By similarity). {ECO:0000250|UniProtKB:Q9NNW5}.","INTERGENERATIONAL"
"MSS51","gasAcul21402-RA","Similar to MSS51: Putative protein MSS51 homolog, mitochondrial (Homo sapiens OX=9606)","Gy_chrV",0.175963399612881,"Putative protein MSS51 homolog, mitochondrial",NA,"INTERGENERATIONAL"
"PEX6","gasAcul09628-RA","Similar to PEX6: Peroxisome assembly factor 2 (Homo sapiens OX=9606)","Gy_chrIX",0.174733531364669,"Peroxisome assembly factor 2","FUNCTION: Component of the PEX1-PEX6 AAA ATPase complex, a protein dislocase complex that mediates the ATP-dependent extraction of the PEX5 receptor from peroxisomal membranes, an essential step for PEX5 recycling (PubMed:23929341, PubMed:9539740). Specifically recognizes PEX5 monoubiquitinated at 'Cys-11', and pulls it out of the peroxisome lumen through the PEX2-PEX10-PEX12 retrotranslocation channel (By similarity). Extraction by the PEX1-PEX6 AAA ATPase complex is accompanied by unfolding of the TPR repeats and release of bound cargo from PEX5 (By similarity). {ECO:0000250|UniProtKB:Q13608, ECO:0000269|PubMed:23929341, ECO:0000269|PubMed:9539740}.","INFECTION_INDUCED"
"NUFIP2","gasAcul06122-RA","Similar to NUFIP2: Nuclear fragile X mental retardation-interacting protein 2 (Homo sapiens OX=9606)","Gy_chrVII",0.17247326664367,"Nuclear fragile X mental retardation-interacting protein 2","FUNCTION: Binds RNA. {ECO:0000250|UniProtKB:Q7Z417}.","INFECTION_INDUCED"
"PGBD4","gasAcul22284-RA","Similar to PGBD4: PiggyBac transposable element-derived protein 4 (Homo sapiens OX=9606)","Gy_chrXXI",0.171703296703297,"PiggyBac transposable element-derived protein 4",NA,"INTERGENERATIONAL"
"sox3","gasAcul04397-RA","Similar to sox3: Transcription factor Sox-3 (Danio rerio OX=7955)","Gy_chrIV",0.170386777986028,"Transcription factor Sox-3","FUNCTION: Catalyzes the oxidation of sulfhydryl groups in peptide and protein thiols to disulfides with the reduction of oxygen to hydrogen peroxide. Plays a role in disulfide bond formation in a variety of extracellular proteins. In fibroblasts, required for normal incorporation of laminin into the extracellular matrix, and thereby for normal cell-cell adhesion and cell migration. {ECO:0000250|UniProtKB:O00391}.","INFECTION_INDUCED"
"Mydgf","gasAcul16368-RA","Similar to Mydgf: Myeloid-derived growth factor (Mus musculus OX=10090)","Gy_chrVIII",0.168634064080944,"Myeloid-derived growth factor","FUNCTION: Bone marrow-derived monocyte and paracrine-acting protein that promotes cardiac myocyte survival and adaptive angiogenesis for cardiac protection and/or repair after myocardial infarction (MI). Stimulates endothelial cell proliferation through a MAPK1/3-, STAT3- and CCND1-mediated signaling pathway. Inhibits cardiac myocyte apoptosis in a PI3K/AKT-dependent signaling pathway. {ECO:0000250|UniProtKB:Q9CPT4}.","INFECTION_INDUCED"
"PENK","gasAcul21603-RA","Similar to PENK: Proenkephalin-A (Bos taurus OX=9913)","Gy_chrXVIII",0.168293503870751,"Proenkephalin-A","FUNCTION: O-methyltransferase; part of the gene cluster that mediates the biosynthesis of penigequinolones, potent insecticidal alkaloids that contain a highly modified 10-carbon prenyl group (PubMed:25859931). The first stage is catalyzed by the nonribosomal peptide synthetase penN that condenses anthranilic acid and O-methyl-L-tyrosine to produce 4'-methoxycyclopeptin (By similarity). 4'-methoxycyclopeptin is then converted to 4'-methoxydehydrocyclopeptin by the ketoglutarate-dependent dioxygenase penM through dehydrogenation to form a double bond between C-alpha and C-beta of the O-methyltyrosine side chain (By similarity). PenM also converts its first product methoxydehydrocyclopeptin to 4'-methoxycyclopenin (By similarity). The following conversion of 4'methoxycyclopenin into 4'-methoxyviridicatin is catalyzed by the cyclopenase penL (By similarity). 4'-methoxyviridicatin is the precursor of quinolone natural products, and is further converted to quinolinone B (Probable). The prenyltransferase penI then catalyzes the canonical Friedel-Crafts alkylation of quinolinone B with dimethylallyl cation to yield dimethylallyl quinolone, which is subjected to FAD-dependent dehydrogenation by the FAD-linked oxidoreductase penH to yield conjugated aryl diene (PubMed:25859931). The delta(3') double bond then serves as the site of the second alkylation with DMAPP catalyzed by the prenyltransferase penG to yield a carbenium ion intermediate, which can be attacked by H(2)O to yield a styrenyl quinolone containing a C3'-hydroxyprenyl chain, or undergo cyclization to yield yaequinolones J1 and J2 (PubMed:25859931). The conversion of the styrenyl quinolone into the tetrahydrofuran-containing yaequinolone C is performed by the FAD-dependent monooxygenase penE and involves epoxidation of the terminal C7'-C8' olefin, followed by epoxide ring opening initiated by the C3' hydroxyl group (PubMed:25859931). The predicted cysteine hydrolase penJ acts as an epoxide hydrolase that enhances the rate of the 5-exo-tet cyclization step, increasing the yield of yaequinolone C (PubMed:25859931, PubMed:28114276). PenF catalyzes the cationic rearrangement of the epoxide formed by penE (before ring opening to produce yaequinolone C) into yaequinolone D (PubMed:28114276). Finally, the short-chain dehydrogenase/reductase (SDR)-like reductase penD, catalyzes both the dehydration of yaequinolone D and the reduction of the resulting oxonium to yield penigequinolone (PubMed:28114276). {ECO:0000250|UniProtKB:C8VJQ3, ECO:0000250|UniProtKB:Q5AR53, ECO:0000250|UniProtKB:Q5AR54, ECO:0000269|PubMed:25859931, ECO:0000269|PubMed:28114276, ECO:0000305|PubMed:25859931}.","INFECTION_INDUCED"
"BEND5","gasAcul16422-RA","Similar to BEND5: BEN domain-containing protein 5 (Homo sapiens OX=9606)","Gy_chrVIII",0.167982529816899,"BEN domain-containing protein 5","FUNCTION: May act as a transcriptional repressor. {ECO:0000250|UniProtKB:Q7L4P6}.","INFECTION_INDUCED"
"Idh3a","gasAcul08723-RA","Similar to Idh3a: Isocitrate dehydrogenase [NAD] subunit alpha, mitochondrial (Mus musculus OX=10090)","Gy_chrII",0.167252048837598,"Isocitrate dehydrogenase [NAD] subunit alpha, mitochondrial","FUNCTION: Catalytic subunit of the enzyme which catalyzes the decarboxylation of isocitrate (ICT) into alpha-ketoglutarate. The heterodimer composed of the alpha (IDH3A) and beta (IDH3B) subunits and the heterodimer composed of the alpha (IDH3A) and gamma (IDH3G) subunits, have considerable basal activity but the full activity of the heterotetramer (containing two subunits of IDH3A, one of IDH3B and one of IDH3G) requires the assembly and cooperative function of both heterodimers. {ECO:0000269|PubMed:7654189}.","INTERGENERATIONAL"
"unknown","gasAcul05692-RA","Protein of unknown function","Gy_chrVII",0.165398610651671,NA,NA,"INTERGENERATIONAL"
"CASR","gasAcul07231-RA","Similar to CASR: Extracellular calcium-sensing receptor (Sus scrofa OX=9823)","Gy_chrI",0.164149704530532,"Extracellular calcium-sensing receptor","FUNCTION: G-protein-coupled receptor that senses changes in the extracellular concentration of calcium ions and plays a key role in maintaining calcium homeostasis. Senses fluctuations in the circulating calcium concentration and modulates the production of parathyroid hormone (PTH) in parathyroid glands (By similarity). The activity of this receptor is mediated by a G-protein that activates a phosphatidylinositol-calcium second messenger system. The G-protein-coupled receptor activity is activated by a co-agonist mechanism: aromatic amino acids, such as Trp or Phe, act concertedly with divalent cations, such as calcium or magnesium, to achieve full receptor activation (By similarity). {ECO:0000250|UniProtKB:P41180, ECO:0000250|UniProtKB:Q9QY96}.","INFECTION_INDUCED"
"lhx1a","gasAcul07530-RA","Similar to lhx1a: LIM/homeobox protein Lhx1 (Danio rerio OX=7955)","Gy_chrI",0.161368404066484,"LIM/homeobox protein Lhx1","FUNCTION: Seems to play a role in dorsal axis formation. {ECO:0000269|PubMed:7768180}.","INTERGENERATIONAL"
"Kif16b","gasAcul15444-RA","Similar to Kif16b: Kinesin-like protein KIF16B (Mus musculus OX=10090)","Gy_chrVI",0.158478605388273,"Kinesin-like protein KIF16B","FUNCTION: Plus end-directed microtubule-dependent motor protein involved in endosome transport and receptor recycling and degradation. Regulates the plus end motility of early endosomes and the balance between recycling and degradation of receptors such as EGF receptor (EGFR) and FGF receptor (FGFR). Regulates the Golgi to endosome transport of FGFR-containing vesicles during early development, a key process for developing basement membrane and epiblast and primitive endoderm lineages during early postimplantation development. {ECO:0000269|PubMed:21238925}.","INFECTION_INDUCED"
"far1","gasAcul05303-RA","Similar to far1: Fatty acyl-CoA reductase 1 (Xenopus laevis OX=8355)","Gy_chrIV",0.158277936055714,"Fatty acyl-CoA reductase 1","FUNCTION: Inhibitor of the cyclin-dependent kinase CDC28. Necessary for cell cycle arrest. Involved in pheromone response. Contributes to mating efficiency. Required for oriented polarization of yeast cells in response to mating pheromones.","INFECTION_INDUCED"
"ARHGAP6","gasAcul05468-RA","Similar to ARHGAP6: Rho GTPase-activating protein 6 (Homo sapiens OX=9606)","Gy_chrVII",0.158052789631737,"Rho GTPase-activating protein 6","FUNCTION: GTPase activator for the Rho-type GTPases by converting them to an inactive GDP-bound state. Could regulate the interactions of signaling molecules with the actin cytoskeleton. Promotes continuous elongation of cytoplasmic processes during cell motility and simultaneous retraction of the cell body changing the cell morphology. {ECO:0000269|PubMed:10699171}.","INFECTION_INDUCED"
"AKT3","gasAcul15779-RA","Similar to AKT3: RAC-gamma serine/threonine-protein kinase (Homo sapiens OX=9606)","Gy_chrVI",0.157035175879397,"RAC-gamma serine/threonine-protein kinase","FUNCTION: Highly selective and weak inward-rectifying potassium channel. Plays a role in both loading and unloading potassium into/from the phloem sap. Seems to control sugar loading into phloem via a voltage-dependent process. Blocked by physiological concentrations of external calcium and by external acidification. May interact with the cytoskeleton or with regulatory proteins. Dephosphorylation by PP2CA not only leads to the inhibition of potassium currents but also to an increase of the voltage-dependence of the channel. Regulated by the CBL4/CIPK6 calcium sensor/protein kinase complex via a kinase interaction-dependent but phosphorylation-independent translocation of the channel to the plasma membrane. {ECO:0000269|PubMed:12447548, ECO:0000269|PubMed:12678562}.","INTERGENERATIONAL"
"PCDH11X","gasAcul04502-RA","Similar to PCDH11X: Protocadherin-11 X-linked (Sus scrofa OX=9823)","Gy_chrIV",0.155303618574313,"Protocadherin-11 X-linked","FUNCTION: Potential calcium-dependent cell-adhesion protein. {ECO:0000250}.","INTERGENERATIONAL"
"PCDH11X","gasAcul04502-RA","Similar to PCDH11X: Protocadherin-11 X-linked (Sus scrofa OX=9823)","Gy_chrIV",0.155303618574313,"Protocadherin-11 X-linked","FUNCTION: Potential calcium-dependent cell-adhesion protein. {ECO:0000250}.","INFECTION_INDUCED"
"Prox1","gasAcul18856-RA","Similar to Prox1: Prospero homeobox protein 1 (Mus musculus OX=10090)","Gy_chrXV",0.15460729746444,"Prospero homeobox protein 1","FUNCTION: Transcription factor involved in developmental processes such as cell fate determination, gene transcriptional regulation and progenitor cell regulation in a number of organs. Plays a critical role in embryonic development and functions as a key regulatory protein in neurogenesis and the development of the heart, eye lens, liver, pancreas and the lymphatic system. Involved in the regulation of the circadian rhythm. Represses: transcription of the retinoid-related orphan receptor RORG, transcriptional activator activity of RORA and RORG and the expression of RORA/G-target genes including core clock components: BMAL1, NPAS2 and CRY1 and metabolic genes: AVPR1A and ELOVL3. {ECO:0000269|PubMed:23723244, ECO:0000303|PubMed:22733308}.","INFECTION_INDUCED"
