"GeneSymbol","feature.name","Note","chrom","nDMSperGenekb","GeneName","Function","effect"
"FUS","gasAcul18597-RA","Similar to FUS: RNA-binding protein FUS (Bos taurus OX=9913)","Gy_chrXI",0.111172873818788,"RNA-binding protein FUS","FUNCTION: Catalyzes the GTP-dependent ribosomal translocation step during translation elongation. During this step, the ribosome changes from the pre-translocational (PRE) to the post-translocational (POST) state as the newly formed A-site-bound peptidyl-tRNA and P-site-bound deacylated tRNA move to the P and E sites, respectively. Catalyzes the coordinated movement of the two tRNA molecules, the mRNA and conformational changes in the ribosome (By similarity). {ECO:0000250}.","INTERGENERATIONAL"
"RNF31","gasAcul17599-RA","Similar to RNF31: E3 ubiquitin-protein ligase RNF31 (Homo sapiens OX=9606)","Gy_chrIII",0.110582771204246,"E3 ubiquitin-protein ligase RNF31","FUNCTION: E3 ubiquitin-protein ligase component of the LUBAC complex which conjugates linear ('Met-1'-linked) polyubiquitin chains to substrates and plays a key role in NF-kappa-B activation and regulation of inflammation (PubMed:28701375). LUBAC conjugates linear polyubiquitin to IKBKG and RIPK1 and is involved in activation of the canonical NF-kappa-B and the JNK signaling pathways (By similarity). Linear ubiquitination mediated by the LUBAC complex interferes with TNF-induced cell death and thereby prevents inflammation (PubMed:28701375). LUBAC is recruited to the TNF-R1 signaling complex (TNF-RSC) following polyubiquitination of TNF-RSC components by BIRC2 and/or BIRC3 and to conjugate linear polyubiquitin to IKBKG and possibly other components contributing to the stability of the complex (By similarity). The LUBAC complex is also involved in innate immunity by conjugating linear polyubiquitin chains at the surface of bacteria invading the cytosol to form the ubiquitin coat surrounding bacteria (By similarity). LUBAC is not able to initiate formation of the bacterial ubiquitin coat, and can only promote formation of linear polyubiquitins on pre-existing ubiquitin (By similarity). Recruited to the surface of bacteria by RNF213, which initiates the bacterial ubiquitin coat (By similarity). The bacterial ubiquitin coat acts as an 'eat-me' signal for xenophagy and promotes NF-kappa-B activation (By similarity). Together with OTULIN, the LUBAC complex regulates the canonical Wnt signaling during angiogenesis (By similarity). RNF31 is required for linear ubiquitination of BCL10, thereby promoting TCR-induced NF-kappa-B activation (By similarity). Binds polyubiquitin of different linkage types (By similarity). {ECO:0000250|UniProtKB:Q96EP0, ECO:0000269|PubMed:28701375}.","INFECTION_INDUCED"
"CERS2","gasAcul19617-RA","Similar to CERS2: Ceramide synthase 2 (Bos taurus OX=9913)","Gy_chrX",0.110436223081171,"Ceramide synthase 2","FUNCTION: Ceramide synthase that catalyzes the transfer of the acyl chain from acyl-CoA to a sphingoid base, with high selectivity toward very-long-chain fatty acyl-CoA (chain length C22-C27) (By similarity). N-acylates sphinganine and sphingosine bases to form dihydroceramides and ceramides in de novo synthesis and salvage pathways, respectively (By similarity). Plays a non-redundant role in the synthesis of ceramides with very-long-chain fatty acids in kidney, liver and brain. Regulates the abundance of myelin-specific sphingolipids galactosylceramide and sulfatide that affects myelin sheath architecture and motor neuron functions (By similarity). {ECO:0000250|UniProtKB:Q924Z4, ECO:0000250|UniProtKB:Q96G23}.","INFECTION_INDUCED"
"ANTXR1","gasAcul20964-RA","Similar to ANTXR1: Anthrax toxin receptor 1 (Homo sapiens OX=9606)","Gy_chrV",0.109517029898149,"Anthrax toxin receptor 1","FUNCTION: Plays a role in cell attachment and migration. Interacts with extracellular matrix proteins and with the actin cytoskeleton. Mediates adhesion of cells to type 1 collagen and gelatin, reorganization of the actin cytoskeleton and promotes cell spreading. Plays a role in the angiogenic response of cultured umbilical vein endothelial cells. {ECO:0000250|UniProtKB:Q9H6X2}.","INTERACTION"
"gpr54","gasAcul17397-RA","Similar to gpr54: G-protein coupled receptor 54 (Oreochromis niloticus OX=8128)","Gy_chrIII",0.109493047191503,"G-protein coupled receptor 54","FUNCTION: Receptor speculated to be essential for sexual development. May regulate gonadotropin-releasing hormone (GnRH) secretion. The receptor expression could be a 'stop signal' for GnRH1, GnRH2, and GnRH3 neuronal migration, leading to suppression of cell growth and modulation of GnRH secretion, which is important for normal sexual development.","INFECTION_INDUCED"
"FAM193B","gasAcul04712-RA","Similar to FAM193B: Protein FAM193B (Homo sapiens OX=9606)","Gy_chrIV",0.109457092819615,"Protein FAM193B",NA,"INTERGENERATIONAL"
"luzp2","gasAcul08652-RA","Similar to luzp2: Leucine zipper protein 2 (Danio rerio OX=7955)","Gy_chrII",0.106871860639094,"Leucine zipper protein 2",NA,"INTERGENERATIONAL"
"MAGI3","gasAcul11812-RA","Similar to MAGI3: Membrane-associated guanylate kinase, WW and PDZ domain-containing protein 3 (Gallus gallus OX=9031)","Gy_chrXVII",0.106587081645705,"Membrane-associated guanylate kinase, WW and PDZ domain-containing protein 3","FUNCTION: Acts as a scaffolding protein at cell-cell junctions, thereby regulating various cellular and signaling processes. {ECO:0000250}.","INFECTION_INDUCED"
"Sugt1","gasAcul16718-RA","Similar to Sugt1: Protein SGT1 homolog (Rattus norvegicus OX=10116)","Gy_chrIII",0.106128946670204,"Protein SGT1 homolog","FUNCTION: May play a role in ubiquitination and subsequent proteasomal degradation of target proteins.","INTERGENERATIONAL"
"ST6GALNAC3","gasAcul17262-RA","Similar to ST6GALNAC3: Alpha-N-acetylgalactosaminide alpha-2,6-sialyltransferase 3 (Homo sapiens OX=9606)","Gy_chrIII",0.10404744563521,"Alpha-N-acetylgalactosaminide alpha-2,6-sialyltransferase 3","FUNCTION: Transfers the sialyl group (N-acetyl-alpha-neuraminyl or NeuAc) from CMP-NeuAc to the GalNAc residue on the NeuAc-alpha-2,3-Gal-beta-1,3-GalNAc sequence of glycoproteins and glycolipids forming an alpha-2,6-linkage. Produces branched type disialyl structures by transfer of a sialyl group onto a GalNAc residue inside the backbone core chains. ST6GalNAcIII prefers glycolipids to glycoproteins, predominantly catalyzing the biosynthesis of ganglioside GD1alpha from GM1b (PubMed:8631773). GD1alpha is a critical molecule in the communication and interaction between neuronal cells and their supportive cells, particularly in brain tissues, and functions as an adhesion molecule in the process of metastasis (By similarity). Sialylation of glycoproteins or glycosphingolipids is very important in tumor development, neuronal development, nerve repair, immunological processes and regulation of hormone sensitivity (By similarity). {ECO:0000250|UniProtKB:Q8NDV1, ECO:0000250|UniProtKB:Q9QYJ1, ECO:0000269|PubMed:8631773}.","INFECTION_INDUCED"
"DNAJC16","gasAcul12307-RA","Similar to DNAJC16: DnaJ homolog subfamily C member 16 (Homo sapiens OX=9606)","Gy_chrXVII",0.10257462303826,"DnaJ homolog subfamily C member 16","FUNCTION: Plays an important role in regulating the size of autophagosomes during the formation process. {ECO:0000250|UniProtKB:Q9Y2G8}.","INFECTION_INDUCED"
"SH3BP5","gasAcul14364-RA","Similar to SH3BP5: SH3 domain-binding protein 5 (Homo sapiens OX=9606)","Gy_chrXX",0.102207686017989,"SH3 domain-binding protein 5","FUNCTION: Functions as a guanine nucleotide exchange factor (GEF) with specificity for RAB11A and RAB25 (PubMed:26506309, PubMed:30217979). Inhibits the auto- and transphosphorylation activity of BTK. Plays a negative regulatory role in BTK-related cytoplasmic signaling in B-cells. May be involved in BCR-induced apoptotic cell death. {ECO:0000269|PubMed:10339589, ECO:0000269|PubMed:26506309, ECO:0000269|PubMed:30217979, ECO:0000269|PubMed:9571151}.","INTERGENERATIONAL"
"Cldn19","gasAcul12522-RA","Similar to Cldn19: Claudin-19 (Mus musculus OX=10090)","Gy_chrXVII",0.101812258195887,"Claudin-19","FUNCTION: Forms paracellular channels: coassembles with CLDN16 into tight junction strands with cation-selective channels through the strands, conveying epithelial permeability in a process known as paracellular tight junction permeability (By similarity). Involved in the maintenance of ion gradients along the nephron. In the thick ascending limb (TAL) of Henle's loop, facilitates sodium paracellular permeability from the interstitial compartment to the lumen, contributing to the lumen-positive transepithelial potential that drives paracellular magnesium and calcium reabsorption (By similarity). Forms paracellular barriers on its own. In the peripheral nervous system, represents a major constituent of the tight junctions in Schwann cells and contributes to electrical sealing. During retinal neurogenesis, may regulate the barrier properties of tight junctions in retinal pigment epithelium, required for proper retinal tissue differentiation and vision (By similarity). {ECO:0000250|UniProtKB:Q8N6F1, ECO:0000250|UniProtKB:Q9ET38}.","INTERGENERATIONAL"
"Sc5d","gasAcul06569-RA","Similar to Sc5d: Lathosterol oxidase (Mus musculus OX=10090)","Gy_chrVII",0.100928542591845,"Lathosterol oxidase","FUNCTION: Catalyzes the penultimate step of the biosynthesis of cholesterol, the dehydrogenation of lathosterol into 7-dehydrocholesterol (7-DHC). Cholesterol is the major sterol component in mammalian membranes and a precursor for bile acid and steroid hormone synthesis (PubMed:10786622, PubMed:38297129). In addition to its essential role in cholesterol biosynthesis, it also indirectly regulates ferroptosis through the production of 7-DHC. By diverting the spread of damage caused by peroxyl radicals from the phospholipid components to its sterol nucleus, 7-DHC prevents this form of cell death (PubMed:38297129, PubMed:38297130). {ECO:0000269|PubMed:10786622, ECO:0000269|PubMed:38297129, ECO:0000269|PubMed:38297130}.","INTERGENERATIONAL"
"fmr1-b","gasAcul04866-RA","Similar to fmr1-b: Synaptic functional regulator FMR1 (Xenopus laevis OX=8355)","Gy_chrIV",0.100170289492137,"Synaptic functional regulator FMR1","FUNCTION: Multifunctional polyribosome-associated RNA-binding protein that plays a central role in neuronal development and synaptic plasticity through the regulation of alternative mRNA splicing, mRNA stability, mRNA dendritic transport and postsynaptic local protein synthesis of target mRNAs. Acts as an mRNA regulator by mediating formation of some phase-separated membraneless compartment: undergoes liquid-liquid phase separation upon binding to target mRNAs, leading to assemble mRNAs into cytoplasmic ribonucleoprotein granules that concentrate mRNAs with associated regulatory factors (By similarity). Binds poly(G) and poly(U), and to a lower extent poly(A) and poly(C) (By similarity). {ECO:0000250|UniProtKB:P51113, ECO:0000250|UniProtKB:Q06787}.","INFECTION_INDUCED"
"RAB11FIP1","gasAcul11261-RA","Similar to RAB11FIP1: Rab11 family-interacting protein 1 (Homo sapiens OX=9606)","Gy_chrXIII",0.0999400359784129,"Rab11 family-interacting protein 1","FUNCTION: A Rab11 effector protein involved in the endosomal recycling process. Also involved in controlling membrane trafficking along the phagocytic pathway and phagocytosis (By similarity). {ECO:0000250|UniProtKB:Q6WKZ4}.","INFECTION_INDUCED"
"NID1","gasAcul15420-RA","Similar to NID1: Nidogen-1 (Homo sapiens OX=9606)","Gy_chrVI",0.0996313639533725,"Nidogen-1","FUNCTION: Sulfated glycoprotein widely distributed in basement membranes and tightly associated with laminin. Also binds to collagen IV and perlecan. It probably has a role in cell-extracellular matrix interactions.","INFECTION_INDUCED"
"NOMO1","gasAcul08989-RA","Similar to NOMO1: Nodal modulator 1 (Homo sapiens OX=9606)","Gy_chrIX",0.0989707046714173,"Nodal modulator 1","FUNCTION: Component of the multi-pass translocon (MPT) complex that mediates insertion of multi-pass membrane proteins into the lipid bilayer of membranes (PubMed:32820719, PubMed:36261522). The MPT complex takes over after the SEC61 complex: following membrane insertion of the first few transmembrane segments of proteins by the SEC61 complex, the MPT complex occludes the lateral gate of the SEC61 complex to promote insertion of subsequent transmembrane regions (PubMed:36261522). {ECO:0000269|PubMed:32820719, ECO:0000269|PubMed:36261522}.","INFECTION_INDUCED"
"LRTM2","gasAcul05207-RA","Similar to LRTM2: Leucine-rich repeat and transmembrane domain-containing protein 2 (Homo sapiens OX=9606)","Gy_chrIV",0.0984155102844208,"Leucine-rich repeat and transmembrane domain-containing protein 2",NA,"INFECTION_INDUCED"
"PRICKLE3","gasAcul12849-RA","Similar to PRICKLE3: Prickle planar cell polarity protein 3 (Homo sapiens OX=9606)","Gy_chrXII",0.094876660341556,"Prickle planar cell polarity protein 3","FUNCTION: Involved in the planar cell polarity (PCP) pathway that is essential for the polarization of epithelial cells during morphogenetic processes, including gastrulation and neurulation (By similarity). PCP is maintained by two molecular modules, the global and the core modules, PRICKLE3 being part of the core module (By similarity). Distinct complexes of the core module segregate to opposite sides of the cell, where they interact with the opposite complex in the neighboring cell at or near the adherents junctions (By similarity). Involved in the organization of the basal body (By similarity). Involved in cilia growth and positioning (By similarity). Required for proper assembly, stability, and function of mitochondrial membrane ATP synthase (mitochondrial complex V) (PubMed:32516135). {ECO:0000250|UniProtKB:A8WH69, ECO:0000269|PubMed:32516135}.","INFECTION_INDUCED"
"MTRF1L","gasAcul15899-RA","Similar to MTRF1L: Peptide chain release factor 1-like, mitochondrial (Bos taurus OX=9913)","Gy_chrVI",0.0943574259294206,"Peptide chain release factor 1-like, mitochondrial","FUNCTION: Mitochondrial peptide chain release factor that directs the termination of translation in response to the peptide chain termination codons UAA and UAG. {ECO:0000250|UniProtKB:Q9UGC7}.","INFECTION_INDUCED"
"Acan","gasAcul08668-RA","Similar to Acan: Aggrecan core protein (Rattus norvegicus OX=10116)","Gy_chrII",0.0942418245217227,"Aggrecan core protein","FUNCTION: This proteoglycan is a major component of extracellular matrix of cartilagenous tissues. A major function of this protein is to resist compression in cartilage. It binds avidly to hyaluronic acid via an N-terminal globular region. May play a regulatory role in the matrix assembly of the cartilage.","INFECTION_INDUCED"
"cep170b","gasAcul18761-RA","Similar to cep170b: Centrosomal protein of 170 kDa protein B (Xenopus laevis OX=8355)","Gy_chrXV",0.0934055669717915,"Centrosomal protein of 170 kDa protein B","FUNCTION: Plays a role in microtubule organization. {ECO:0000250|UniProtKB:Q5SW79}.","INTERGENERATIONAL"
"sphkap","gasAcul07005-RA","Similar to sphkap: A-kinase anchor protein SPHKAP (Danio rerio OX=7955)","Gy_chrI",0.0929843321400344,"A-kinase anchor protein SPHKAP","FUNCTION: Anchoring protein that binds preferentially to the type I regulatory subunit of c-AMP-dependent protein kinase (PKA type I) and targets it to distinct subcellular compartments. May act as a converging factor linking cAMP and sphingosine signaling pathways. Plays a regulatory role in the modulation of SPHK1 (By similarity). {ECO:0000250}.","INFECTION_INDUCED"
"FBP1","gasAcul11560-RA","Similar to FBP1: Fructose-1,6-bisphosphatase 1 (Bos taurus OX=9913)","Gy_chrXIII",0.0926698174404596,"Fructose-1,6-bisphosphatase 1",NA,"INTERACTION"
"NSUN7","gasAcul08819-RA","Similar to NSUN7: Putative methyltransferase NSUN7 (Homo sapiens OX=9606)","Gy_chrIX",0.091432751211484,"Putative methyltransferase NSUN7","FUNCTION: May have S-adenosyl-L-methionine-dependent methyl-transferase activity. {ECO:0000305}.","INFECTION_INDUCED"
"Rbm27","gasAcul06517-RA","Similar to Rbm27: RNA-binding protein 27 (Mus musculus OX=10090)","Gy_chrVII",0.091166013310238,"RNA-binding protein 27","FUNCTION: May be involved in the turnover of nuclear polyadenylated (pA+) RNA. {ECO:0000250|UniProtKB:Q9P2N5}.","INTERGENERATIONAL"
"Kiaa0319l","gasAcul19550-RA","Similar to Kiaa0319l: Dyslexia-associated protein KIAA0319-like protein (Pongo abelii OX=9601)","Gy_chrX",0.0909918107370337,"Dyslexia-associated protein KIAA0319-like protein","FUNCTION: Possible role in axon guidance through interaction with RTN4R. {ECO:0000250|UniProtKB:Q8IZA0}.","INFECTION_INDUCED"
"il1rapl1b","gasAcul13775-RA","Similar to il1rapl1b: Interleukin-1 receptor accessory protein-like 1-B (Danio rerio OX=7955)","Gy_chrXVI",0.090711175616836,"Interleukin-1 receptor accessory protein-like 1-B","FUNCTION: May regulate secretion and presynaptic differentiation through inhibition of the activity of N-type voltage-gated calcium channel. During presynaptic differentiation may regulate both synaptic vesicle accumulation in axon terminals and subsequent axon terminal remodeling. {ECO:0000269|PubMed:18657618}.","INFECTION_INDUCED"
"Tut7","gasAcul10831-RA","Similar to Tut7: Terminal uridylyltransferase 7 (Mus musculus OX=10090)","Gy_chrXIII",0.0904404449669892,"Terminal uridylyltransferase 7","FUNCTION: Uridylyltransferase that mediates the terminal uridylation of mRNAs with short (less than 25 nucleotides) poly(A) tails, hence facilitating global mRNA decay (PubMed:28792939). Essential for both oocyte maturation and fertility. Through 3' terminal uridylation of mRNA, sculpts, with TUT7, the maternal transcriptome by eliminating transcripts during oocyte growth (PubMed:28792939). Involved in microRNA (miRNA)-induced gene silencing through uridylation of deadenylated miRNA targets. Also acts as a suppressor of miRNA biogenesis by mediating the terminal uridylation of miRNA precursors, including that of let-7 (pre-let-7) (PubMed:22898984). Uridylated pre-let-7 RNA is not processed by Dicer and undergo degradation. Pre-let-7 uridylation is strongly enhanced in the presence of LIN28A. Due to functional redundancy between ZCCHC6 and ZCCHC11, the identification of the specific role of each of these proteins is difficult (By similarity) (PubMed:22898984). Involved in microRNA (miRNA)-induced gene silencing through uridylation of deadenylated miRNA targets (By similarity). Also functions as an integral regulator of microRNA biogenesiS using 3 different uridylation mechanisms (By similarity). Acts as a suppressor of miRNA biogenesis by mediating the terminal uridylation of some miRNA precursors, including that of let-7 (pre-let-7). Uridylated pre-let-7 RNA is not processed by Dicer and undergo degradation. Pre-let-7 oligouridylation is strongly enhanced in the presence of LIN28A (PubMed:22898984). In the absence of LIN28A, TUT7 and TUT4 monouridylate group II pre-miRNAs, which includes most of pre-let7 members, that shapes an optimal 3' end overhang for efficient processing (By similarity). Add oligo-U tails to truncated pre-miRNAS with a 5' overhang which may promote rapid degradation of non-functional pre-miRNA species (By similarity). Does not play a role in replication-dependent histone mRNA degradation (By similarity). Due to functional redundancy between TUT4 and TUT7, the identification of the specific role of each of these proteins is difficult (PubMed:22898984, PubMed:28792939). TUT4 and TUT7 restrict retrotransposition of long interspersed element-1 (LINE-1) in cooperation with MOV10 counteracting the RNA chaperonne activity of L1RE1. TUT7 uridylates LINE-1 mRNAs in the cytoplasm which inhibits initiation of reverse transcription once in the nucleus, whereas uridylation by TUT4 destabilizes mRNAs in cytoplasmic ribonucleoprotein granules (By similarity). {ECO:0000250|UniProtKB:Q5VYS8, ECO:0000269|PubMed:22898984, ECO:0000269|PubMed:28792939}.","INFECTION_INDUCED"
"SEMA7A","gasAcul08044-RA","Similar to SEMA7A: Semaphorin-7A (Homo sapiens OX=9606)","Gy_chrII",0.0893974611121044,"Semaphorin-7A","FUNCTION: Plays an important role in integrin-mediated signaling and functions both in regulating cell migration and immune responses. Promotes formation of focal adhesion complexes, activation of the protein kinase PTK2/FAK1 and subsequent phosphorylation of MAPK1 and MAPK3. Promotes production of pro-inflammatory cytokines by monocytes and macrophages. Plays an important role in modulating inflammation and T-cell-mediated immune responses. Promotes axon growth in the embryonic olfactory bulb. Promotes attachment, spreading and dendrite outgrowth in melanocytes. {ECO:0000269|PubMed:12879062, ECO:0000269|PubMed:17377534, ECO:0000269|PubMed:17671519}.","INTERGENERATIONAL"
"cnep1r1","gasAcul08559-RA","Similar to cnep1r1: Nuclear envelope phosphatase-regulatory subunit 1 (Danio rerio OX=7955)","Gy_chrII",0.0891901534070639,"Nuclear envelope phosphatase-regulatory subunit 1","FUNCTION: Forms with the serine/threonine protein phosphatase CTDNEP1 an active complex which dephosphorylates and may activate LPIN1 and LPIN2. LPIN1 and LPIN2 are phosphatidate phosphatases that catalyze the conversion of phosphatidic acid to diacylglycerol and control the metabolism of fatty acids at different levels. May indirectly modulate the lipid composition of nuclear and/or endoplasmic reticulum membranes and be required for proper nuclear membrane morphology and/or dynamics. May also indirectly regulate the production of lipid droplets and triacylglycerol (By similarity). {ECO:0000250}.","INFECTION_INDUCED"
"UBTF","gasAcul17583-RA","Similar to UBTF: Nucleolar transcription factor 1 (Homo sapiens OX=9606)","Gy_chrIII",0.089118616879066,"Nucleolar transcription factor 1","FUNCTION: Recognizes the ribosomal RNA gene promoter and activates transcription mediated by RNA polymerase I (Pol I) through cooperative interactions with the transcription factor SL1/TIF-IB complex. It binds specifically to the upstream control element and can activate Pol I promoter escape. {ECO:0000269|PubMed:11250903, ECO:0000269|PubMed:11283244, ECO:0000269|PubMed:16858408, ECO:0000269|PubMed:28777933, ECO:0000269|PubMed:7982918}.","INTERGENERATIONAL"
"Scarf2","gasAcul11530-RA","Similar to Scarf2: Scavenger receptor class F member 2 (Mus musculus OX=10090)","Gy_chrXIII",0.0887075312694048,"Scavenger receptor class F member 2","FUNCTION: Probable adhesion protein, which mediates homophilic and heterophilic interactions. In contrast to SCARF1, it poorly mediates the binding and degradation of acetylated low density lipoprotein (Ac-LDL).","INTERGENERATIONAL"
"MAN1C1","gasAcul14420-RA","Similar to MAN1C1: Mannosyl-oligosaccharide 1,2-alpha-mannosidase IC (Homo sapiens OX=9606)","Gy_chrXX",0.0885269121813031,"Mannosyl-oligosaccharide 1,2-alpha-mannosidase IC","FUNCTION: Involved in the maturation of Asn-linked oligosaccharides. Trim alpha-1,2-linked mannose residues from Man(9)GlcNAc(2) to produce first Man(8)GlcNAc(2) then Man(6)GlcNAc and a small amount of Man(5)GlcNAc.","INTERGENERATIONAL"
"DRD3","gasAcul22467-RA","Similar to DRD3: D(3) dopamine receptor (Homo sapiens OX=9606)","Gy_chrXXI",0.0884486113568017,"D","FUNCTION: Dopamine receptor whose activity is mediated by G proteins which inhibit adenylyl cyclase. Promotes cell proliferation (By similarity). {ECO:0000250}.","INTERGENERATIONAL"
"MYOM2","gasAcul09699-RA","Similar to MYOM2: Myomesin-2 (Homo sapiens OX=9606)","Gy_chrIX",0.0882145377558222,"Myomesin-2","FUNCTION: Major component of the vertebrate myofibrillar M band. Binds myosin, titin, and light meromyosin. This binding is dose dependent.","INFECTION_INDUCED"
"ZNF710","gasAcul08499-RA","Similar to ZNF710: Zinc finger protein 710 (Homo sapiens OX=9606)","Gy_chrII",0.0875656742556918,"Zinc finger protein 710","FUNCTION: May be involved in transcriptional regulation.","INFECTION_INDUCED"
"PPFIBP1","gasAcul05325-RA","Similar to PPFIBP1: Liprin-beta-1 (Homo sapiens OX=9606)","Gy_chrIV",0.0875580071797566,"Liprin-beta-1","FUNCTION: May regulate the disassembly of focal adhesions. Did not bind receptor-like tyrosine phosphatases type 2A. {ECO:0000269|PubMed:9624153}.","ADDITIVE"
"Opn5","gasAcul22123-RA","Similar to Opn5: Opsin-5 (Mus musculus OX=10090)","Gy_chrXVIII",0.0874125874125874,"Opsin-5","FUNCTION: G-protein coupled receptor which selectively activates G(i) type G proteins via ultraviolet A (UVA) light-mediated activation in the retina (By similarity). Preferentially binds the chromophore 11-cis retinal and is a bistable protein that displays emission peaks at 380 nm (UVA light) and 470 nm (blue light) (PubMed:22043319). Required for the light-response in the inner plexiform layer, and contributes to the regulation of the light-response in the nerve fiber layer, via phosphorylated DAT/SLC6A3 dopamine uptake (By similarity). Involved in local corneal and retinal circadian rhythm photoentrainment via modulation of the UVA light-induced phase-shift of the retina clock (By similarity). Acts as a circadian photoreceptor in the outer ear, via modulation of circadian clock-gene expression in response to violet light during the light-to-dark transition phase and night phase of the circadian cycle (By similarity). Required in the retina to negatively regulate hyaloid vessel regression during postnatal development via light-dependent OPN5-SLC32A1-DRD2-VEGFR2 signaling (By similarity). Involved in the light-dependent regulation of retina and vitreous compartment dopamine levels (By similarity). {ECO:0000250|UniProtKB:Q6VZZ7, ECO:0000269|PubMed:22043319}.","INFECTION_INDUCED"
