"GeneSymbol","feature.name","Note","chrom","nDMSperGenekb","GeneName","Function","effect"
"unknown","gasAcul20657-RA","Protein of unknown function","Gy_chrXIV",4.08163265306122,NA,NA,"INFECTION_INDUCED"
"unknown","gasAcul21810-RA","Protein of unknown function","Gy_chrXVIII",2.6525198938992,NA,NA,"INTERGENERATIONAL"
"CD4","gasAcul14733-RA","Similar to CD4: T-cell surface glycoprotein CD4 (Pan troglodytes OX=9598)","Gy_chrXX",2.02429149797571,"T-cell surface glycoprotein CD4","FUNCTION: Integral membrane glycoprotein that plays an essential role in the immune response and serves multiple functions in responses against both external and internal offenses. In T-cells, functions primarily as a coreceptor for MHC class II molecule:peptide complex. The antigens presented by class II peptides are derived from extracellular proteins while class I peptides are derived from cytosolic proteins. Interacts simultaneously with the T-cell receptor (TCR) and the MHC class II presented by antigen presenting cells (APCs). In turn, recruits the Src kinase LCK to the vicinity of the TCR-CD3 complex. LCK then initiates different intracellular signaling pathways by phosphorylating various substrates ultimately leading to lymphokine production, motility, adhesion and activation of T-helper cells. In other cells such as macrophages or NK cells, plays a role in differentiation/activation, cytokine expression and cell migration in a TCR/LCK-independent pathway. Participates in the development of T-helper cells in the thymus and triggers the differentiation of monocytes into functional mature macrophages. {ECO:0000269|PubMed:16951326, ECO:0000269|PubMed:24942581, ECO:0000269|PubMed:2823150, ECO:0000269|PubMed:7604010}.; FUNCTION: (Microbial infection) Primary receptor for human immunodeficiency virus-1 (HIV-1) (PubMed:12089508, PubMed:16331979, PubMed:2214026, PubMed:9641677). Down-regulated by HIV-1 Vpu (PubMed:17346169). Acts as a receptor for Human Herpes virus 7/HHV-7 (PubMed:7909607). {ECO:0000269|PubMed:12089508, ECO:0000269|PubMed:16331979, ECO:0000269|PubMed:17346169, ECO:0000269|PubMed:2214026, ECO:0000269|PubMed:7909607, ECO:0000269|PubMed:9641677}.","INTERGENERATIONAL"
"unknown","gasAcul14683-RA","Protein of unknown function","Gy_chrXX",1.22286762457964,NA,NA,"INFECTION_INDUCED"
"unknown","gasAcul14683-RA","Protein of unknown function","Gy_chrXX",1.22286762457964,NA,NA,"INTERGENERATIONAL"
"Gzf1","gasAcul22132-RA","Similar to Gzf1: GDNF-inducible zinc finger protein 1 (Rattus norvegicus OX=10116)","Gy_chrXVIII",1.21951219512195,"GDNF-inducible zinc finger protein 1","FUNCTION: Transcriptional repressor that binds the GZF1 responsive element (GRE) (consensus: 5'-TGCGCN[TG][CA]TATA-3'). May be regulating VSX2/HOX10 expression. {ECO:0000250|UniProtKB:Q9H116}.","INFECTION_INDUCED"
"gpr146","gasAcul18407-RA","Similar to gpr146: Probable G-protein coupled receptor 146 (Xenopus laevis OX=8355)","Gy_chrXI",1.11607142857143,"Probable G-protein coupled receptor 146","FUNCTION: Orphan receptor.","INFECTION_INDUCED"
"OR2AG2","gasAcul14183-RA","Similar to OR2AG2: Olfactory receptor 2AG2 (Homo sapiens OX=9606)","Gy_chrXVI",1.10619469026549,"Olfactory receptor 2AG2","FUNCTION: Odorant receptor. {ECO:0000305}.","INTERGENERATIONAL"
"mafaa","gasAcul16134-RA","Similar to mafaa: Transcription factor MafAa (Danio rerio OX=7955)","Gy_chrVIII",1.06269925611052,"Transcription factor MafAa","FUNCTION: Transcription factor, possibly involved in transcription regulation during lens development, including that of crystallin genes (PubMed:11134968). Specifically binds to the alphaCE2 enhancer element of crystallin gene (PubMed:11134968). {ECO:0000269|PubMed:11134968}.","INTERGENERATIONAL"
"C1qtnf7","gasAcul16589-RA","Similar to C1qtnf7: Complement C1q tumor necrosis factor-related protein 7 (Mus musculus OX=10090)","Gy_chrVIII",1.001001001001,"Complement C1q tumor necrosis factor-related protein 7",NA,"INTERGENERATIONAL"
"unknown","gasAcul17164-RA","Protein of unknown function","Gy_chrIII",0.985221674876847,NA,NA,"INFECTION_INDUCED"
"unknown","gasAcul18801-RA","Protein of unknown function","Gy_chrXV",0.945179584120983,NA,NA,"INFECTION_INDUCED"
"unknown","gasAcul18801-RA","Protein of unknown function","Gy_chrXV",0.945179584120983,NA,NA,"INTERGENERATIONAL"
"Mrps22","gasAcul06838-RA","Similar to Mrps22: 28S ribosomal protein S22, mitochondrial (Mus musculus OX=10090)","Gy_chrI",0.80032012805122,"28S ribosomal protein S22, mitochondrial",NA,"INFECTION_INDUCED"
"Tmed11","gasAcul04238-RA","Similar to Tmed11: Transmembrane emp24 domain-containing protein 11 (Mus musculus OX=10090)","Gy_chrIV",0.796812749003984,"Transmembrane emp24 domain-containing protein 11","FUNCTION: Part of a complex whose function is to bind Ca(2+) to the ER membrane and thereby regulate the retention of ER resident proteins.","INTERGENERATIONAL"
"unknown","gasAcul04885-RA","Protein of unknown function","Gy_chrIV",0.79428117553614,NA,NA,"INFECTION_INDUCED"
"unknown","gasAcul04227-RA","Protein of unknown function","Gy_chrIV",0.784313725490196,NA,NA,"INFECTION_INDUCED"
"unknown","gasAcul15265-RA","Protein of unknown function","Gy_chrVI",0.753579502637528,NA,NA,"INFECTION_INDUCED"
"unknown","gasAcul19276-RA","Protein of unknown function","Gy_chrXV",0.731528895391368,NA,NA,"INTERGENERATIONAL"
"Mgat2","gasAcul22165-RA","Similar to Mgat2: Alpha-1,6-mannosyl-glycoprotein 2-beta-N-acetylglucosaminyltransferase (Rattus norvegicus OX=10116)","Gy_chrXVIII",0.7097232079489,"Alpha-1,6-mannosyl-glycoprotein 2-beta-N-acetylglucosaminyltransferase","FUNCTION: Plays an essential role in protein N-glycosylation. Catalyzes the transfer of N-acetylglucosamine (GlcNAc) onto the free terminal mannose moiety in the core structure of the nascent N-linked glycan chain, giving rise to the second branch in complex glycans. {ECO:0000250|UniProtKB:Q10469}.","INFECTION_INDUCED"
"Vwde","gasAcul07859-RA","Similar to Vwde: von Willebrand factor D and EGF domain-containing protein (Mus musculus OX=10090)","Gy_chrI",0.659848234905972,"von Willebrand factor D and EGF domain-containing protein",NA,"INTERGENERATIONAL"
"NDFIP2","gasAcul07647-RA","Similar to NDFIP2: NEDD4 family-interacting protein 2 (Homo sapiens OX=9606)","Gy_chrI",0.641573994867408,"NEDD4 family-interacting protein 2","FUNCTION: Activates HECT domain-containing E3 ubiquitin-protein ligases, including ITCH, NEDD4, NEDD4L, SMURF2, WWP1 and WWP2, and consequently modulates the stability of their targets. As a result, may control many cellular processes. Recruits ITCH, NEDD4 and SMURF2 to endosomal membranes. Negatively regulates KCNH2 potassium channel activity by decreasing its cell-surface expression and interfering with channel maturation through recruitment of NEDD4L to the Golgi apparatus and multivesicular body where it mediates KCNH2 degradation (By similarity). May modulate EGFR signaling (By similarity). Together with NDFIP1, limits the cytokine signaling and expansion of effector Th2 T-cells by promoting degradation of JAK1, probably by ITCH- and NEDD4L-mediated ubiquitination (PubMed:27088444). {ECO:0000250|UniProtKB:Q9NV92, ECO:0000269|PubMed:12050153, ECO:0000269|PubMed:15252135, ECO:0000269|PubMed:27088444}.","INFECTION_INDUCED"
"unknown","gasAcul06790-RA","Protein of unknown function","Gy_chrI",0.606244316459533,NA,NA,"INTERGENERATIONAL"
"eomes","gasAcul19607-RA","Similar to eomes: Eomesodermin (Xenopus laevis OX=8355)","Gy_chrX",0.571755288736421,"Eomesodermin","FUNCTION: Functions as a transcriptional activator playing a crucial role during development. Functions in trophoblast differentiation and later in gastrulation, regulating both mesoderm delamination and endoderm specification. Plays a role in brain development being required for the specification and the proliferation of the intermediate progenitor cells and their progeny in the cerebral cortex. Also involved in the differentiation of CD8+ T-cells during immune response regulating the expression of lytic effector genes. {ECO:0000269|PubMed:10716450, ECO:0000269|PubMed:14605368, ECO:0000269|PubMed:18171685, ECO:0000269|PubMed:18940588}.","INFECTION_INDUCED"
"DCUN1D1","gasAcul17162-RA","Similar to DCUN1D1: DCN1-like protein 1 (Gallus gallus OX=9031)","Gy_chrIII",0.551419906258616,"DCN1-like protein 1","FUNCTION: Part of an E3 ubiquitin ligase complex for neddylation. Promotes neddylation of cullin components of E3 cullin-RING ubiquitin ligase complexes. Acts by binding to cullin-RBX1 complexes in the cytoplasm and promoting their nuclear translocation, enhancing recruitment of E2-NEDD8 (UBE2M-NEDD8) thioester to the complex, and optimizing the orientation of proteins in the complex to allow efficient transfer of NEDD8 from the E2 to the cullin substrates. {ECO:0000250|UniProtKB:Q96GG9}.","INFECTION_INDUCED"
"PCDH7","gasAcul05628-RA","Similar to PCDH7: Protocadherin-7 (Homo sapiens OX=9606)","Gy_chrVII",0.53715308863026,"Protocadherin-7",NA,"INFECTION_INDUCED"
"CCN2","gasAcul22184-RA","Similar to CCN2: CCN family member 2 (Sus scrofa OX=9823)","Gy_chrXVIII",0.530503978779841,"CCN family member 2","FUNCTION: Major connective tissue mitoattractant secreted by vascular endothelial cells. Promotes proliferation and differentiation of chondrocytes (By similarity). Mediates heparin- and divalent cation-dependent cell adhesion in many cell types including fibroblasts, myofibroblasts, endothelial and epithelial cells (By similarity). Enhances fibroblast growth factor-induced DNA synthesis (By similarity). {ECO:0000250|UniProtKB:P29279}.","INFECTION_INDUCED"
"COMMD10","gasAcul10923-RA","Similar to COMMD10: COMM domain-containing protein 10 (Homo sapiens OX=9606)","Gy_chrXIII",0.527009222661397,"COMM domain-containing protein 10",NA,"INFECTION_INDUCED"
"TRAF4","gasAcul07297-RA","Similar to TRAF4: TNF receptor-associated factor 4 (Homo sapiens OX=9606)","Gy_chrI",0.514271020827976,"TNF receptor-associated factor 4","FUNCTION: Adapter protein with E3 ligase activity that is involved in many diverse biological processes including cell proliferation, migration, differentiation, DNA repair, platelet activation or apoptosis. Promotes EGFR-mediated signaling by facilitating the dimerization of EGFR and downstream AKT activation thereby promoting cell proliferation. Ubiquitinates SMURF2 through 'Lys-48'-linked ubiquitin chain leading to SMURF2 degradation through the proteasome and subsequently osteogenic differentiation. Promotes 'Lys-63'-mediated ubiquitination of CHK1 which in turn activates cell cycle arrest and activation of DNA repair. In addition, promotes an atypical 'Lys-29'-linked ubiquitination at the C-terminal end of IRS1 which is crucial for insulin-like growth factor (IGF) signal transduction (By similarity). Regulates activation of NF-kappa-B in response to signaling through Toll-like receptors. Required for normal skeleton development, and for normal development of the respiratory tract. Required for activation of RPS6KB1 in response to TNF signaling. Modulates TRAF6 functions. Inhibits adipogenic differentiation by activating pyruvate kinase PKM activity and subsequently the beta-catenin signaling pathway (By similarity). {ECO:0000250, ECO:0000250|UniProtKB:Q9BUZ4}.","INFECTION_INDUCED"
"Uncharacterized protein CXorf38 homolog","gasAcul16715-RA","Similar to Uncharacterized protein CXorf38 homolog (Mus musculus OX=10090)","Gy_chrIII",0.51413881748072,NA,NA,"INTERGENERATIONAL"
"unknown","gasAcul15825-RA","Protein of unknown function","Gy_chrVI",0.510725229826353,NA,NA,"INTERGENERATIONAL"
"unknown","gasAcul17683-RA","Protein of unknown function","Gy_chrXI",0.50761421319797,NA,NA,"INFECTION_INDUCED"
"MRM2","gasAcul18428-RA","Similar to MRM2: rRNA methyltransferase 2, mitochondrial (Homo sapiens OX=9606)","Gy_chrXI",0.495049504950495,"rRNA methyltransferase 2, mitochondrial","FUNCTION: S-adenosyl-L-methionine-dependent 2'-O-ribose methyltransferase that catalyzes the formation of 2'-O-methyluridine at position 2791 (Um2791) in the 21S mitochondrial large subunit ribosomal RNA (mtLSU rRNA), a universally conserved modification in the peptidyl transferase domain of the mtLSU rRNA. {ECO:0000269|PubMed:11867542}.","INFECTION_INDUCED"
"Psma6","gasAcul21642-RA","Similar to Psma6: Proteasome subunit alpha type-6 (Rattus norvegicus OX=10116)","Gy_chrXVIII",0.489715964740451,"Proteasome subunit alpha type-6","FUNCTION: Component of the 20S core proteasome complex involved in the proteolytic degradation of most intracellular proteins. This complex plays numerous essential roles within the cell by associating with different regulatory particles. Associated with two 19S regulatory particles, forms the 26S proteasome and thus participates in the ATP-dependent degradation of ubiquitinated proteins. The 26S proteasome plays a key role in the maintenance of protein homeostasis by removing misfolded or damaged proteins that could impair cellular functions, and by removing proteins whose functions are no longer required. Associated with the PA200 or PA28, the 20S proteasome mediates ubiquitin-independent protein degradation. This type of proteolysis is required in several pathways including spermatogenesis (20S-PA200 complex) or generation of a subset of MHC class I-presented antigenic peptides (20S-PA28 complex). {ECO:0000269|PubMed:15244466, ECO:0000269|PubMed:27176742, ECO:0000269|PubMed:8610016}.","INTERGENERATIONAL"
"unknown","gasAcul04331-RA","Protein of unknown function","Gy_chrIV",0.479156684235745,NA,NA,"INFECTION_INDUCED"
"unknown","gasAcul21256-RA","Protein of unknown function","Gy_chrV",0.476587632550935,NA,NA,"INFECTION_INDUCED"
"unknown","gasAcul05961-RA","Protein of unknown function","Gy_chrVII",0.474608448030375,NA,NA,"INFECTION_INDUCED"
"DHX58","gasAcul17972-RA","Similar to DHX58: Probable ATP-dependent RNA helicase DHX58 (Homo sapiens OX=9606)","Gy_chrXI",0.473372781065089,"Probable ATP-dependent RNA helicase DHX58","FUNCTION: Acts as a regulator of RIGI and IFIH1/MDA5 mediated antiviral signaling. Cannot initiate antiviral signaling as it lacks the CARD domain required for activating MAVS/IPS1-dependent signaling events. Can have both negative and positive regulatory functions related to RIGI and IFIH1/MDA5 signaling and this role in regulating signaling may be complex and could probably depend on characteristics of the infecting virus or target cells, or both. Its inhibitory action on RIG-I signaling may involve the following mechanisms: competition with RIGI for binding to the viral RNA, binding to RIGI and inhibiting its dimerization and interaction with MAVS/IPS1, competing with IKBKE in its binding to MAVS/IPS1 thereby inhibiting activation of interferon regulatory factor 3 (IRF3). Its positive regulatory role may involve unwinding or stripping nucleoproteins of viral RNA thereby facilitating their recognition by RIGI and IFIH1/MDA5. Involved in the innate immune response to various RNA viruses and some DNA viruses such as poxviruses and coronavirus SARS-CoV-2, and also to the bacterial pathogen Listeria monocytogenes (PubMed:31256877). Can bind both ssRNA and dsRNA, with a higher affinity for dsRNA. Shows a preference to 5'-triphosphorylated RNA, although it can recognize RNA lacking a 5'-triphosphate. {ECO:0000269|PubMed:16116171, ECO:0000269|PubMed:17020950, ECO:0000269|PubMed:17190814, ECO:0000269|PubMed:18411269, ECO:0000269|PubMed:19208642, ECO:0000269|PubMed:19211564, ECO:0000269|PubMed:19278996, ECO:0000269|PubMed:19380577, ECO:0000269|PubMed:21187438, ECO:0000269|PubMed:21525357, ECO:0000269|PubMed:31256877}.","INFECTION_INDUCED"
"Cradd","gasAcul05425-RA","Similar to Cradd: Death domain-containing protein CRADD (Mus musculus OX=10090)","Gy_chrIV",0.459981600735971,"Death domain-containing protein CRADD","FUNCTION: Adapter protein that associates with PIDD1 and the caspase CASP2 to form the PIDDosome, a complex that activates CASP2 and triggers apoptosis. Also recruits CASP2 to the TNFR-1 signaling complex through its interaction with RIPK1 and TRADD and may play a role in the tumor necrosis factor-mediated signaling pathway. {ECO:0000250|UniProtKB:P78560}.","INTERGENERATIONAL"
"Arsi","gasAcul04596-RA","Similar to Arsi: Arylsulfatase I (Mus musculus OX=10090)","Gy_chrIV",0.438212094653812,"Arylsulfatase I","FUNCTION: Displays arylsulfatase activity at neutral pH, when co-expressed with SUMF1; arylsulfatase activity is measured in the secretion medium of retinal cell line, but no activity is recorded when measured in cell extracts. {ECO:0000250|UniProtKB:Q5FYB1}.","INFECTION_INDUCED"
"sox8","gasAcul20910-RA","Similar to sox8: Transcription factor Sox-8 (Xenopus laevis OX=8355)","Gy_chrV",0.437254044599913,"Transcription factor Sox-8","FUNCTION: Transcription factor that may play a role in central nervous system, limb and facial development. May be involved in male sex determination. Binds the consensus motif 5'-[AT][AT]CAA[AT]G-3' (By similarity). {ECO:0000250|UniProtKB:Q04886}.","INTERGENERATIONAL"
"zdhhc23a","gasAcul06480-RA","Similar to zdhhc23a: Palmitoyltransferase ZDHHC23-A (Danio rerio OX=7955)","Gy_chrVII",0.435540069686411,"Palmitoyltransferase ZDHHC23-A","FUNCTION: Palmitoyltransferase that could catalyze the addition of palmitate onto various protein substrates and be involved in a variety of cellular processes. {ECO:0000250|UniProtKB:Q8IYP9}.","INFECTION_INDUCED"
"Stk24","gasAcul07812-RA","Similar to Stk24: Serine/threonine-protein kinase 24 (Mus musculus OX=10090)","Gy_chrI",0.431096421899698,"Serine/threonine-protein kinase 24","FUNCTION: Serine/threonine-protein kinase that acts on both serine and threonine residues and promotes apoptosis in response to stress stimuli and caspase activation. Mediates oxidative-stress-induced cell death by modulating phosphorylation of JNK1-JNK2 (MAPK8 and MAPK9), p38 (MAPK11, MAPK12, MAPK13 and MAPK14) during oxidative stress. Plays a role in a staurosporine-induced caspase-independent apoptotic pathway by regulating the nuclear translocation of AIFM1 and ENDOG and the DNase activity associated with ENDOG. Phosphorylates STK38L on 'Thr-442' and stimulates its kinase activity. In association with STK26 negatively regulates Golgi reorientation in polarized cell migration upon RHO activation. Regulates also cellular migration with alteration of PTPN12 activity and PXN phosphorylation: phosphorylates PTPN12 and inhibits its activity and may regulate PXN phosphorylation through PTPN12 (By similarity). May act as a key regulator of axon regeneration in the optic nerve and radial nerve (PubMed:19855390). Part of the striatin-interacting phosphatase and kinase (STRIPAK) complexes. STRIPAK complexes have critical roles in protein (de)phosphorylation and are regulators of multiple signaling pathways including Hippo, MAPK, nuclear receptor and cytoskeleton remodeling. Different types of STRIPAK complexes are involved in a variety of biological processes such as cell growth, differentiation, apoptosis, metabolism and immune regulation (By similarity). {ECO:0000250|UniProtKB:Q9Y6E0, ECO:0000269|PubMed:19855390}.","INTERGENERATIONAL"
"Stk24","gasAcul07812-RA","Similar to Stk24: Serine/threonine-protein kinase 24 (Mus musculus OX=10090)","Gy_chrI",0.431096421899698,"Serine/threonine-protein kinase 24","FUNCTION: Serine/threonine-protein kinase that acts on both serine and threonine residues and promotes apoptosis in response to stress stimuli and caspase activation. Mediates oxidative-stress-induced cell death by modulating phosphorylation of JNK1-JNK2 (MAPK8 and MAPK9), p38 (MAPK11, MAPK12, MAPK13 and MAPK14) during oxidative stress. Plays a role in a staurosporine-induced caspase-independent apoptotic pathway by regulating the nuclear translocation of AIFM1 and ENDOG and the DNase activity associated with ENDOG. Phosphorylates STK38L on 'Thr-442' and stimulates its kinase activity. In association with STK26 negatively regulates Golgi reorientation in polarized cell migration upon RHO activation. Regulates also cellular migration with alteration of PTPN12 activity and PXN phosphorylation: phosphorylates PTPN12 and inhibits its activity and may regulate PXN phosphorylation through PTPN12 (By similarity). May act as a key regulator of axon regeneration in the optic nerve and radial nerve (PubMed:19855390). Part of the striatin-interacting phosphatase and kinase (STRIPAK) complexes. STRIPAK complexes have critical roles in protein (de)phosphorylation and are regulators of multiple signaling pathways including Hippo, MAPK, nuclear receptor and cytoskeleton remodeling. Different types of STRIPAK complexes are involved in a variety of biological processes such as cell growth, differentiation, apoptosis, metabolism and immune regulation (By similarity). {ECO:0000250|UniProtKB:Q9Y6E0, ECO:0000269|PubMed:19855390}.","INFECTION_INDUCED"
"Ampd3","gasAcul08276-RA","Similar to Ampd3: AMP deaminase 3 (Mus musculus OX=10090)","Gy_chrII",0.425531914893617,"AMP deaminase 3","FUNCTION: AMP deaminase plays a critical role in energy metabolism. {ECO:0000305|PubMed:9133604}.","INFECTION_INDUCED"
"IFIT5","gasAcul16116-RA","Similar to IFIT5: Interferon-induced protein with tetratricopeptide repeats 5 (Homo sapiens OX=9606)","Gy_chrVIII",0.416666666666667,"Interferon-induced protein with tetratricopeptide repeats 5","FUNCTION: Interferon-induced RNA-binding protein involved in the human innate immune response. Has a broad and adaptable RNA structure recognition important for RNA recognition specificity in antiviral defense. Binds precursor and processed tRNAs as well as poly-U-tailed tRNA fragments (PubMed:23317505, PubMed:23774268, PubMed:25092312). Specifically binds single-stranded RNA bearing a 5'-triphosphate group (PPP-RNA), thereby acting as a sensor of viral single-stranded RNAs. Single-stranded PPP-RNAs, which lack 2'-O-methylation of the 5' cap and bear a 5'-triphosphate group instead, are specific from viruses, providing a molecular signature to distinguish between self and non-self mRNAs by the host during viral infection. Directly binds PPP-RNA in a non-sequence-specific manner (PubMed:23334420). Also recognizes and selectively binds AT-rich dsDNA (PubMed:23774268). Additionally, as a mediator in innate immunity, positively regulates IKK-NFKB signaling by sinergizing the recruitment of IKK to MAP3K7 (PubMed:26334375). {ECO:0000269|PubMed:23317505, ECO:0000269|PubMed:23334420, ECO:0000269|PubMed:23774268, ECO:0000269|PubMed:25092312, ECO:0000269|PubMed:26334375}.","INTERGENERATIONAL"
"kbtbd12","gasAcul11965-RA","Similar to kbtbd12: Kelch repeat and BTB domain-containing protein 12 (Danio rerio OX=7955)","Gy_chrXVII",0.41631973355537,"Kelch repeat and BTB domain-containing protein 12",NA,"INFECTION_INDUCED"
"RPL7L1","gasAcul21583-RA","Similar to RPL7L1: 60S ribosomal protein L7-like 1 (Homo sapiens OX=9606)","Gy_chrXVIII",0.412201154163232,"60S ribosomal protein L7-like 1",NA,"INTERGENERATIONAL"
"ccnj","gasAcul15349-RA","Similar to ccnj: Cyclin-J (Xenopus laevis OX=8355)","Gy_chrVI",0.394944707740916,"Cyclin-J",NA,"INTERGENERATIONAL"
"Rab11fip5","gasAcul04472-RA","Similar to Rab11fip5: Rab11 family-interacting protein 5 (Mus musculus OX=10090)","Gy_chrIV",0.376269910949454,"Rab11 family-interacting protein 5","FUNCTION: Rab effector involved in protein trafficking from apical recycling endosomes to the apical plasma membrane. Involved in insulin granule exocytosis. May regulate V-ATPase intracellular transport in response to extracellular acidosis. {ECO:0000269|PubMed:19335615}.","INFECTION_INDUCED"
"Pcp4","gasAcul05514-RA","Similar to Pcp4: Calmodulin regulator protein PCP4 (Rattus norvegicus OX=10116)","Gy_chrVII",0.36941263391208,"Calmodulin regulator protein PCP4","FUNCTION: Functions as a modulator of calcium-binding by calmodulin. Thereby, regulates calmodulin activity and the different processes it controls (PubMed:19106096, PubMed:23204517, PubMed:27876793). For instance, may play a role in neuronal differentiation through activation of calmodulin-dependent kinase signaling pathways (PubMed:21491429). {ECO:0000269|PubMed:19106096, ECO:0000269|PubMed:21491429, ECO:0000269|PubMed:23204517, ECO:0000269|PubMed:27876793}.","INFECTION_INDUCED"
"LRR1","gasAcul18949-RA","Similar to LRR1: Leucine-rich repeat protein 1 (Homo sapiens OX=9606)","Gy_chrXV",0.366300366300366,"Leucine-rich repeat protein 1","FUNCTION: Involved in plant defense response. {ECO:0000250|UniProtKB:Q5VQP7}.","INFECTION_INDUCED"
"Gtf3c4","gasAcul20636-RA","Similar to Gtf3c4: General transcription factor 3C polypeptide 4 (Mus musculus OX=10090)","Gy_chrXIV",0.364232380258605,"General transcription factor 3C polypeptide 4","FUNCTION: Essential for RNA polymerase III to make a number of small nuclear and cytoplasmic RNAs, including 5S RNA, tRNA, and adenovirus-associated (VA) RNA of both cellular and viral origin. Has histone acetyltransferase activity (HAT) with unique specificity for free and nucleosomal H3. May cooperate with GTF3C5 in facilitating the recruitment of TFIIIB and RNA polymerase through direct interactions with BRF1, POLR3C and POLR3F. May be localized close to the A box (By similarity). {ECO:0000250}.","INTERGENERATIONAL"
"Gtf3c4","gasAcul20636-RA","Similar to Gtf3c4: General transcription factor 3C polypeptide 4 (Mus musculus OX=10090)","Gy_chrXIV",0.364232380258605,"General transcription factor 3C polypeptide 4","FUNCTION: Essential for RNA polymerase III to make a number of small nuclear and cytoplasmic RNAs, including 5S RNA, tRNA, and adenovirus-associated (VA) RNA of both cellular and viral origin. Has histone acetyltransferase activity (HAT) with unique specificity for free and nucleosomal H3. May cooperate with GTF3C5 in facilitating the recruitment of TFIIIB and RNA polymerase through direct interactions with BRF1, POLR3C and POLR3F. May be localized close to the A box (By similarity). {ECO:0000250}.","INFECTION_INDUCED"
